Proposal Number,Phase 1 Contract #,Subtopic Title,Proposal Title,Small Business Concern_Firm,Small Business Concern_Address,Small Business Concern_Phone,Principal Investigator_Name,Principal Investigator_E-mail,Principal Investigator_Address,Principal Investigator_Phone,Business Official_Name,Business Official_E-mail,Business Official_Address,Business Official_Phone,TRL_Begin,TRL_End,Technical Abstract,Potential NASA applications,Potential non-NASA applications,Technology Taxonomy Mapping
12-2 S1.06-9362,NNX13CG22P,Cryogenic Systems for Sensors and Detectors,Lightweight Superconducting Magnets for Low Temperature Magnetic Coolers,"Creare, Inc.","P.O. Box 71, Hanover, NH 03755 - 3116",(603) 643-3800,Weibo Chen,wbc@creare.com,"P.O. Box 71, Hanover, NH 03755 - 3116",(603) 643-3800  Extension :2425,Robert J Kline-Schoder,contractsmgr@creare.com,"P.O. Box 71, Hanover, NH 03755 - 3116",(603) 643-3800  Extension :2487,3,4,"NASA's future science missions to investigate the structure and evolution of the universe require efficient, very low temperature coolers for low noise detector systems.  We propose to develop a highly efficient, lightweight Active Magnetic Regenerative Refrigeration (AMRR) system that can continuously provide remote/distributed cooling at temperatures of about 2 K with a heat sink at about 15 K.  The AMRR system uses three novel design features to achieve a large cooling capacity and very high thermal efficiency: a vibration-free, reversible cryogenic circulator; innovative micromachined regenerators; and lightweight superconducting magnets.  The superconducting magnet uses low-current superconducting wires and a unique winding arrangement to enable an AMRR system to achieve high thermal efficiency. In Phase I, we selected an optimum superconducting material for the magnet and developed its electrical and structural support subsystems.  Based on the performance characteristics of the magnet, we optimized the magnetic field and showed by analysis that the AMRR system driven by such a magnetic field will be able to achieve high efficiency.  In Phase II, we will build and characterize a superconducting magnet, assemble a brassboard AMRR system with a circulator and an active magnetic regenerator, and demonstrate the system performance under prototypical conditions.  In Phase III, we will assemble a fully integrated Engineering Model AMRR system and demonstrate its performance.","The proposed AMRR system will enable NASA to carry out future space astronomy missions that use cryogenic infrared, gamma ray, and X ray detectors.  These detectors need to operate at temperatures in the range of 4 K to below 1 K to reduce the thermal emission of the detectors themselves and to achieve high sensitivity and resolution.  The vibration-free, lightweight AMRR can provide efficient cooling for these missions at the required temperature ranges.  The fabrication technologies developed for the lightweight superconducting magnets can also be applied to the fabrication of advanced magnets for multistage active demagnetization refrigerators (ADRs), particle accelerators, and portable MRIs.","Military applications for the proposed magnetic cooler include cooling systems on space-based surveillance, missile detection, and missile tracking systems.  Scientific applications include cooling systems for material microanalysis using X ray microcalorimeter spectrometers, superconducting radio frequency cavities, superconducting cavities, and superconducting digital electronics.",Cryogenic/Fluid Systems
12-2 S1.07-9410,NNX13CA37P,In Situ Sensors and Sensor Systems for Lunar and Planetary Science,ChemCam-like Spectrometer for Non-Contact Measurements of Key Isotopes,"Applied Spectra, Inc.","46665 Fremont Boulevard, Fremont, CA 94538 - 6410",(510) 657-7679,Alexander A. Bolshakov,alexandb@appliedspectra.com,"46665 Fremont Boulevard, Fremont, CA 94538 - 6410",(510) 657-7679  Extension :121,Alexander A. Bolshakov,alexandb@appliedspectra.com,"46665 Fremont Boulevard, Fremont, CA 94538 - 6410",(510) 657-7679  Extension :121,2,4,"This project addresses the need for a non-contact instrument capable of measuring the isotopic ratios O-18/O-16 and D/H from water ice and other solid materials (rocks). Frozen H2O is the dominant ice in the outer solar system, recently found on the Moon. Extensive deposits of near-surface ice discovered on Mars. Oxygen and hydrogen isotopic records preserve history of water/rock interactions depending on chemistry and ambient conditions. Ratios of these isotopes are the main tool in paleoclimatology studies on Earth. A proposed non-contact optical instrument similar to ChemCam will be capable of measuring not only complete elemental compositions but also the key isotopic abundances in surface materials. We demonstrated the resolution and sensitivity required to determine these isotopes in synthetic samples and natural minerals relevant to Mars. We are utilizing and developing our recently published technology: Laser Ablation Molecular Isotopic Spectrometry (LAMIS). Our concept is simple and scientifically proven. We will advance to TRL4 with the further aim of integrating our LAMIS detector with a ChemCam-like instrument. The proposed effort leverages and advances the technology developed for ChemCam. The added strength of measuring isotopes will greatly expand the capabilities of the ChemCam, which is already a highly successful instrument onboard ""Curiosity"". We will develop a breadboard prototype of the instrument that can be later amended to measure other key isotopes (C, N, B, Cl, Mg, Ca, Sr). We plan further infusion in NASA missions and commercialization. The immediate focus is on Mars but our concept is also highly germane to future landing missions to the Moon, other planets and their moons, asteroids, and to a broad range of applications in ecology, agronomy, nuclear industry, radio-chemotherapy, forensics, security and other fields. Our instrument can be used for stand-alone landing missions or for in situ sample characterization prior to sample return.","Our non-contact optical instrument will rapidly measure elemental compositions (~30 elements simultaneously) and key isotopic abundances in planetary surface materials. The isotope ratios of D/H and O-18/O-16 will provide important constraints on the history of processes on Mars, particularly related to past water activities. We first aim at oxygen and hydrogen in this proposal but we have also shown that our technology can be extended to many other chemical elements. This technology is directly relevant to several NASA objectives for Mars: (i) characterization of geological features contributing to deciphering geological history; (ii) determination of surface chemical composition including elements known to be building blocks for life; (iii) characterization of organic compounds and potential biomarkers in representative bedrock and regolith; (iv) identification of potential chemical and isotopic biosignatures in rocks and regolith; (v) characterization of the local environment, the state and cycling of water and CO2, and the near-surface distribution of hydrogen. NRC's decadal survey recommended a plan leading to Mars Sample Return. As part of this program, there is a need to conduct in situ analysis to select the best and most varied set of samples to return to Earth. Our proposal is particularly focused on Mars but highly relevant to applications on the Moon, other planets, their moons and asteroids. Similar studies are very important to NASA's Earth Science missions.","Our concept of an integrated instrument capable of both elemental and isotopic measurements has significant commercial applications. LAMIS is poised to speed up, to simplify and to make isotopic analysis more affordable than at present. Multiple applications are anticipated in the nuclear power industry, medical diagnostics and therapies, forensics, homeland security, carbon sequestration, natural gas and oil exploration, ecological and agronomical studies. Heavy water nuclear reactors require deuterium enrichment 99.85%. Water-18O is used as a precursor in the radiopharmaceutical industry. Deuterated drugs and stable isotopic markers are increasingly used in the fields of medicine, pharmacology, nutrition and physiology. Studies of vegetation and different ecosystems include isotopic measurements of soils, flora, fauna, air, groundwater and the results of human activities. Medical multinuclear MRI scanners require compounds enriched in NMR-active isotopes. To assess quality, specifications or aging of these materials, their isotopic homogeneity or distribution, and a degree of isotopic enrichment can be rapidly tested by LAMIS in open air. In animals and humans, stable isotopes are used to study host-parasite relationship. Measurement of the D/H and oxygen isotopic ratios is essential in paleoclimatology, material sciences, biological and medical research. We will apply for further development through newly established NRA programs PICASSO and MatISSE, and also through MIDP.","Analytical Instruments (Solid, Liquid, Gas, Plasma, Energy; see also Sensors); Analytical Methods; Biological Signature (i.e., Signs Of Life); Chemical/Environmental (see also Biological Health/Life Support); Detectors (see also Sensors); Optical/Photonic (see also Photonics); Ultraviolet; Visible"
12-2 S1.07-9558,NNX13CG23P,In Situ Sensors and Sensor Systems for Lunar and Planetary Science,A Comet Surface Sample Return System,"Honeybee Robotics, Ltd.","460 West 34th Street, New York, NY 10001 - 2320",(212) 966-0661,Philip Chu,chu@honeybeerobotics.com,"460 West 34th Street, New York, NY 10001 - 2320",(646) 239-0429,Jack Craft,craft@honeybeerobotics.com,"460 West 34th Street, New York, NY 10001 - 2320",(646) 459-7835,4,5,"The proposed Phase II investigation will focus on the development of spacecraft systems required to obtain a sample from the nucleus of a comet, hermetically seal the sample within a capsule, and return the sealed sample to an orbiting spacecraft which can return the sample to Earth. A systems level concept for the Comet Surface Sample Return Probe has been developed in Phase I. This concept will be refined during the proposed Phase II investigation, including high fidelity prototypes and analyses of critical subsystems. These high fidelity prototypes will include the sample acquisition and handling subsystem, a hermetically sealed sample return canister, and a full scale mockup of the Comet Surface Sample Return Probe.  Orbital mechanics calculations were completed in Phase I based on simplified geometry assumptions of the comets shape and density in order to determine the feasibility of orbiting, impacting and ascending from the comets surface with a small scale spacecraft. During Phase II, these analyses will be refined to include uneven geometry and inconsistent density.","The acquisition of surface samples from small interplanetary bodies such as comets and asteroids, as well as small moons like Mars' Phobos, and Deimos holds great scientific interest.  Under the NASA Authorization Act, Congress instructed NASA to ""plan, develop, and implement a Near-Earth Object (NEO) Survey program to detect, track, catalogue, and characterize the physical characteristics of NEOs equal to or greater than 140 meters in diameter in order to assess the threat of such near-Earth objects to the Earth."" In 2010, President Obama called for a new approach to space exploration, which would include human and robotic exploration of asteroids. In the latest Decadal Survey, the committee recommended selecting a Comet Surface Sample Return mission as one of the five New Frontiers 4 (NF4) missions, solidifying the importance of studying returned physical samples from a comet. The other four included Lunar South Pole-Aitken Basin Sample Return, Saturn Probe, Trojan Tour and Rendezvous, and Venus In Situ Explorer. The Lunar and Venus missions could also benefit from the development of this sampling approach.The sampling probe in the proposed effort could be applied to any number of planetary bodies with a microgravity environment where sample return is desired.","Non-NASA applications for this technology include sampling of contaminated soils and liquid from hazardous environments (near nuclear reactors, oil spills, chemical spills etc). Key subsystems such as the sampling probe, flipper mechanism and hermetic sealing canister could be re-purposed for sampling terrestrial sites. These systems could potentially be deployed from a helicopter with a tether, acquire a sample, hermetically seal it on the ground, and be reeled in with the sample inside the sealed canister. This would reduce the risk of sending personnel into contaminated environments.In addition, commercial companies such as Planetary Resources and Deep Space Industries, who are interested in asteroid mining for economic gains, would use this technology. It would be extremely useful to conduct reconnaissance of target bodies in order to determine their composition (e.g. fraction of water-ice, Platinum Group Metals, Rare Earth Elements etc) and in turn evaluate economic potential for mining the bodies.",Deployment; Machines/Mechanical Subsystems; Robotics (see also Control & Monitoring; Sensors)
12-2 S1.08-8852,NNX13CA39P,Airborne Measurement Systems,AirCore Reusable InSitu Sampler for CO2 and Trace Gas Measurements,"KALSCOTT Engineering, Inc.","P.O. Box 3426, Lawrence, KS 66046 - 0426",(785) 979-1113,Tom Sherwood,tom.sherwood@kalscott.com,"PO Box 3426, Lawrence, KS 66046 - 0426",(785) 979-1113,Suman Saripalli,suman.saripalli@kalscott.com,"PO Box 3426, Lawrence, KS 66046 - 0426",(785) 979-1116,4,7,"A novel design for an in situ air sampling sensor for CO2 and trace gases is proposed. The sensor, named AirCore, provides the advantages of existing in situ sensors (e.g. high resolution) but eliminates possible biases in analysis that often originate from imperfect measurement condition. The AirCore provides a significant savings in cost and weight while increasing the capabilities of existing in situ sensors. The AirCore system consists of the AirCore gas sampler and the support system to accomplish its high altitude (nominally 70,000+ ft.) mission. This support system includes the sensor launch and recovery components. The AirCore can be launched and recovered by a limited crew, which reduces the operational cost of the system.","The proposed sensor can be used to provide ""ground truth"" information for several NASA initiatives on measurements of greenhouse and related gases in the atmosphere, including OCO2/ASCENDS, AURA/TES, and the TCCON sites. We propose to develop an AirCore sensor which will be hoisted aloft on a helium weather balloon to a nominal altitude of 70,000 ft. When the balloon reaches its target altitude, the payload (glider UAV plus AirCore sampler) will be released. The UAV (known as the Retriever) will then follow a prescribed spiraling descent path during which time the AirCore sampler will collect a continuous atmospheric sample. Upon UAV recovery, the AirCore sample will be analyzed.","The sampler methodology can be used for air quality monitoring over cities, industrial and agricultural sites. The UAV can be used for high altitude communication relays (traditional radio and cell), weather parameter monitoring, aerial photography, cloud seeding, etc.","Aerodynamics; Analytical Methods; Attitude Determination & Control; Autonomous Control (see also Control & Monitoring); Hardware-in-the-Loop Testing; Models & Simulations (see also Testing & Evaluation); Prototyping; Simulation & Modeling; Telemetry/Tracking (Cooperative/Noncooperative; see also Planetary Navigation, Tracking, & Telemetry); Vehicles (see also Autonomous Systems)"
12-2 S1.09-9206,NNX13CP25P,Surface & Sub-surface Measurement Systems,Precision Remote Sensor for Oxygen and Carbon Dioxide,"Mesa Photonics, LLC","1550 Pacheco Street, Santa Fe, NM 87505 - 3914",(505) 216-5015,David Bomse,dbomse@mesaphotonics.com,"1550 Pacheco St., Santa Fe, NM 87505 - 3914",(505) 216-5015,David Bomse,dbomse@mesaphotonics.com,"1550 Pacheco St., Santa Fe, NM 87505 - 3914",(505) 216-5015,4,5,"The Phase II project will lead to the design, construction, and field-testing of a prototype PHOCS instrument for atmospheric column retrievals of oxygen and carbon dioxide. The carbon dioxide wavelength range may also be extended to add methane and carbon monoxide measurements depending on laser performance. The prototype will include the improvement to heterodyne spectroscopy invented in Phase I. The project will move Mesa Photonics' technology toward commercializing compact, portable instruments that combine high spectral resolution with high sensitivity and rapid data acquisition.The requirements for implementing a successful Phase II prototype are straightforward responses to the lessons learned in Phase I. The Phase II work plan will implement the following hardware improvements:� Mount the light collection optics on a commercial solar tracker that has a built-in GPS to simplify setup at different locations.� Replace the current external cavity laser used for the oxygen spectral range with a laser having two orders of magnitude better wavelength repeatability and an order of magnitude faster wavelength switching speed.� Eliminate the electronic noise canceller. Phase I results showed that fluctuations in collected sunlight intensity is the dominant PHOCS noise source. Laser excess noise is small in comparison. The Phase I invention does a much better job of improving sensitivity than does the noise canceller.� Switch from a narrowly tunable laser to a widely tunable one for carbon dioxide measurements. As with oxygen, the improved laser will allow fast measurements of selected absorption lines.� Consolidate the signal processing electronics onto a custom-built, compact, low-power circuit board and replace the commercial lock-in amplifier with new dual, single-board lock-in amplifier that Mesa Photonics has developed.","High-resolution, ground-based atmospheric column measurements are now made using solar occultation with high-resolution Fourier transform spectrometers. Called ""transportable,"" rather than portable, these spectrometers are used worldwide by the NASA-funded Total Carbon Column Observation Network (TCCON). These ground-based instruments also have an important role in aiding analysis of satellite remote sensing data. The Orbiting Carbon Observatory 2 (OCO-2) team expects to use TCCON atmospheric profiling results to aid analysis of the space-based carbon dioxide and methane remote sensing data. The OCO-2 satellite is scheduled for launch in 2014.PHOCS instruments will provide atmospheric column information to NASA from locations that are inaccessible to TCCON instruments. By narrowing our measurements to just one species, oxygen, we will be able to determine precise distributions of temperature and pressure fluctuations from the ground to the top of the atmosphere. These distributions are critical information needed for interpreting satellite data.",A secondary market for the proposed technology is for unobtrusive remote sensors that can detect hydrogen fluoride (HF) emissions from clandestine nuclear fuel processing.,"Analytical Instruments (Solid, Liquid, Gas, Plasma, Energy; see also Sensors); Analytical Methods; Chemical/Environmental (see also Biological Health/Life Support); Detectors (see also Sensors); Essential Life Resources (Oxygen, Water, Nutrients); Fiber (see also Communications, Networking & Signal Transport; Photonics); Infrared; Lasers (Measuring/Sensing); Optical/Photonic (see also Photonics); Sources (Renewable, Nonrenewable)"
12-2 S1.09-9600,NNX13CG27P,Surface & Sub-surface Measurement Systems,Multi-Configuration Matched Spectral Filter Core,"Optra, Inc.","461 Boston Street, Topsfield, MA 01983 - 1234",(978) 887-6600,Elizabeth Schundler,eschundler@optra.com,"OPTRA Inc. 461 Boston Street, Topsfield, MA 01983 - 1234",(978) 887-2572,Dianne Young,dyoung@optra.com,"OPTRA, Inc. 461 Boston Street, Topsfield, MA 01983 - 1234",(978) 887-2958,4,7,"OPTRA proposes the development of a modular, reconfigurable matched spectral filter (RMSF) spectrometer for the monitoring of greenhouse and volcanic gases.  The heart of this spectrometer will be an RMSF core, which can be paired with different fore-optics or detector modules to achieve active point or passive standoff detection of the chemicals of interest.  The RMSF core is comprised of a dispersive spectrometer that images the sample spectrum from 3 – 5.5 micron onto a digital micro-mirror device (DMD) such that different columns correspond to different wavebands.  By applying masks to this DMD, a matched spectral filter can be applied in hardware.  This results in a highly flexible system that can address a wide variety of chemicals by simply updating the DMD masks applied and a wide variety of applications through modular hardware design.  Use of the DMD and a single element detector in place of a conventional FPA results in significantly reduced cost and improved performance in terms of image uniformity, pixel operability, and dynamic range.  The proposed Phase II effort will produce a prototype RMSF core with one set of fore-optic and detector modules for each of the two detection modalities.","The primary NASA application is ground, mobile and/or air-based missions which are tasked with greenhouse gas, volcanic gas, and other air pollutant measurements.","Non-NASA applications include fugitive emission monitoring, flare analysis, stack emission monitoring, general environmental and process monitoring, vehicle emissions diagnostics and greenhouse gas monitoring.",Chemical/Environmental (see also Biological Health/Life Support)
12-2 S2.01-9417,NNX13CG28P,Proximity Glare Suppression for Astronomical Coronagraphy,Fabrication Process and Electronics Development for Scaling Segmented MEMS DMs,"Iris AO, Inc.","2680 Bancroft Way, Berkeley, CA 94704 - 1717",(510) 849-2375,Michael Albert Helmbrecht,michael.helmbrecht@irisao.com,"2680 Bancroft Way, Berkeley, CA 94704 - 1717",(510) 849-2375,Michael Albert Helmbrecht,michael.helmbrecht@irisao.com,"2680 Bancroft Way, Berkeley, CA 94704 - 1717",(510) 849-2375,3,4,"Microelectromechanical systems (MEMS) technology has the potential to create deformable mirrors (DM) with more than 10^4 actuators that have size, weight, and power specifications that are far lower than conventional piezoelectric and electrostrictive DMs. However, considerable development is necessary to take state-of-the-art MEMS DMs today and make them flight-like. This Phase II SBIR proposal addresses two critical areas in MEMS DM development towards the goal of developing flight-like hardware. Namely, Phase II research will further develop Iris AO's proven hybrid MEMS DM technology to: 1) develop and demonstrate wafer-scale assembly of deformable mirror arrays and 2) increase drive electronics resolution to >=18 bits using hardware-controlled super-resolution oversampling techniques. The increased spatial and actuator resolution afforded by the development here will enable picometer resolution DMs required to reach 10^10 contrast levels necessary for direct detection of Earth-sized terrestrial planets.","Iris AO technology can be a key enabling component in a host of future NASA missions, including the space telescopes of the 'Origins' program including Terrestrial Planet Finder (TPF), Space Astronomy Far Infrared Telescope (SAFIR), Life Finder, and Planet Imager. Four recent ASMCS concepts require multiple DMs to implement coronagraphs. Two of these, DAViNCI and EPIC, specifically require segmented MEMS DMs. Other potential programs such as Structure and Evolution of the Universe (SEU) and ultraviolet telescopes will also require adaptive optics. Finally, ground based telescopes, like the Thirty Meter Telescope (TMT), Keck, and Gemini North","The proposed adaptive optics technology would find immediate application in several military communications and imaging products. Systems used in military surveillance such as in the Predator drone and Global Hawk would benefit from the high-resolution, light weight, and low power consumption afforded by Iris AO's MEMS. Atmospheric correction enabled by these low-cost but highly capable devices would benefit space situational awareness surveillance applications as well. In the commercial sector, adaptive optics has been employed in research systems in biological imaging, most notably in vision science and microscopy. Several research universities are reporting results using AO-equipped systems. The high segment-count devices enabled by this proposal would lead to unprecedented levels of spatial fidelity for biological imaging applications. Other commercial applications include metrology, laser processing, coherent combination of multiple fiber lasers, and laser beam quality improvement and drift compensation. Iris AO segmented mirrors are uniquely well-suited to higher power applications such as laser processing, combining fiber lasers, and laser beam quality improvement. This advantage lies in the relatively thick segments that enable the use of dielectric coatings which tend to warp conventional surface micromachined MEMS DMs. The precision open-loop operation of Iris AO DMs greatly simplifies the use of DMs in these applications.","Adaptive Optics; Algorithms/Control Software & Systems (see also Autonomous Systems); Characterization; Circuits (including ICs; for specific applications, see e.g., Communications, Networking & Signal Transport; Control & Monitoring, Sensors); Manufacturing Methods; Materials (Insulator, Semiconductor, Substrate); Microelectromechanical Systems (MEMS) and smaller; Microfabrication (and smaller; see also Electronics; Mechanical Systems; Photonics); Mirrors"
