Proposal Number,Phase 1 Contract #,Subtopic Title,Proposal Title,Small Business Concern_Firm,Small Business Concern_Address,Small Business Concern_Phone,Principal Investigator_Name,Principal Investigator_E-mail,Principal Investigator_Address,Principal Investigator_Phone,Business Official_Name,Business Official_E-mail,Business Official_Address,Business Official_Phone,TRL_Begin,TRL_End,Technical Abstract,Potential NASA applications,Potential non-NASA applications,Technology Taxonomy Mapping
12-2 A1.01-9814,NNX13CL11P,Aviation External Hazard Sensor Technologies,RIDES: Raman Icing Detection System,Michigan Aerospace Corporation,"1777 Highland Drive, Suite B, Ann Arbor, MI 48108 - 2285",(734) 975-8777,Charles J Richey,crichey@michiganaerospace.com,"1777 Highland Drive, Suite B, Ann Arbor, MI 48108 - 2285",(734) 975-8777  Extension :112,John A Dodds,jdodds@michaero.com,"1777 Highland Drive, Suite B, Ann Arbor, MI 48108 - 2285",(734) 975-8777  Extension :136,3,5,"Inflight icing of engines and airframe presents a significant hazard to air transport, especially at lower flight elevations during take-off or on approach.  Ice accretions on the wings affect the smooth flow required for proper lift. A thin layer of coarse ice can reduce the lift by 30 percent and increase drag by up to 40 percent.  In addition, accretions can also reduce the air intake in engines and affect readings from a (heated) Pitot tube. Michigan Aerospace Corporation (MAC) proposes to continue the development of an integrated LIDAR instrument capable of identifying icing conditions while also allowing for air data sensing as well as other hazard detection capabilities.  The resulting Raman Icing Detection System (RIDES), when coupled with MAC's optical air data solution, will provide unprecedented situational awareness and aircraft safety. The proposed solution will operate without protrusions into the flow, behind a common flush-mounted window on the skin of the aircraft, mitigating the risk of ice build-up during operation and therefore providing a critical redundancy through dissimilar measurement of air data parameters while greatly enhancing a pilot's awareness of potential icing hazards.  MAC will build on its successful Phase I trade-study and design effort through the fabrication and demonstration of a Phase II prototype in an icing wind tunnel.","An airborne icing condition detection and characterization system, such as RIDES, will have wide applications in the study of the threat icing conditions pose to aircraft. In addition, the system will allow for climate change studies that look at aerosol concentration and distribution, including water vapor/liquid water content, in the atmosphere.  There is potential to combine such a system with MAC's optical air data system and turbulence-detection systems into a unified system that would sense both icing conditions and turbulence hazards ahead and report airspeed along with air, temperature and density routinely.","Outside NASA, military and civil aviation is often affected by icing, sometimes severely (e.g., Comair flight 3272 in 1997, Air France flight 447 in 2009) and the ability to detect these conditions so as to avoid or at least account for them (activating de-icing systems, etc.) would be of tremendous safety value, suggesting a substantial market. Michigan Aerospace Corporation is already working on NASA projects for clear-air turbulence (CAT) detection and volcanic ash detection ahead of an aircraft. Adding SLD to these optical air data system (OADS)-derived capabilities will lead to a powerful suite of optical instruments capable of measuring air data (air speed and direction along with air density and temperature) and warning of icing conditions, volcanic ash and clear-air turbulence, all without protruding into the flow around the aircraft and without ports or probes that can clog with debris or ice up.",Air Transportation & Safety; Interferometric (see also Analysis); Lasers (Ladar/Lidar); Optical/Photonic (see also Photonics); Ultraviolet; Visible
12-2 A1.02-8929,NNX13CC18P,Inflight Icing Hazard Mitigation Technology,Droplet-Sizing Liquid Water Content Sensor,"Anasphere, Inc.","106 Pronghorn Trail, Bozeman, MT 59718 - 6081",(406) 994-9354,John Bognar,jbognar@anasphere.com,"106 Pronghorn Trail, Bozeman, MT 59718 - 6081",(406) 994-9354,John Bognar,jbognar@anasphere.com,"106 Pronghorn Trail, Bozeman, MT 59718 - 6081",(406) 994-9354,6,8,"Icing is one of the most significant hazards to aircraft.  A sizing supercooled liquid water content (SSLWC) sonde is being developed to meet a directly related need for in-situ measurements of both total supercooled liquid water content and droplet size distribution.  This data will support the development of remote sensing instrumentation to detect icing conditions, support aircraft certification activities for flight into known icing conditions, and support the development of new icing-related operational weather forecast products. Phase I demonstrated the feasibility of the SSLWC sonde's measurement technique.  The sonde airframe was designed, built, and tested, mathematical models relating the sonde's raw data to the target variables were completed, a data processing algorithm was developed and implemented, and a proof-of-concept sonde was built.   Phase II will involve refining the sonde design, adapting the mathematical algorithms into their final application environments, conducting additional studies of sonde elements in an icing wind tunnel, and undertaking two field missions to obtain intercomparison data between the SSLWC sonde and other accepted approaches to such measurements.  At the end of Phase II, the SSLWC sonde will be proven to the point that it can be marketed with confidence for the application areas outlined above.",NASA will be able to use the SSLWC sonde to support the development of remote sensing methods for cloud properties and for fundamental research into icing.,"Aircraft certification activities, private sector development of remote sensing techniques, and new icing weather forecast products are three areas of application foreseen for the sonde.  Other scientific agencies, particularly NOAA, DOE, and NSF, are likely to have applications for the sonde in the areas of in-situ cloud research and the development of remote sensing techniques for cloud characterization.  Operational meteorology applications are also foreseen for the FAA (likely through the National Weather Service) in support of new icing safety programs.",Air Transportation & Safety; Chemical/Environmental (see also Biological Health/Life Support)
12-2 A1.03-8396,NNX13CL13P,Flight Deck Interface Technologies for NextGen,"Voice Activated Cockpit Management Systems, VACMS NextGen, from simple to complex architectures","Southern Air Aviation, Inc.","2100 Palomar Airport Road, #205, Carlsbad, CA 92011 - 4404",(619) 917-4299,Doinita Serban,serban@southernairaviation.com,"2100 Palomar Airport Road # 205, Carlsbad, CA 92011 - 4404",(619) 917-4299,Doinita Serban,serban@southernairaviation.com,"2100 Palomar Airport Road # 205, Carlsbad, CA 92011 - 4404",(619) 917-4299,4,7,"Technological advances (GPWS, TCAS, FMS, WAAS, ESV, ADS-B) improved flight safety but engendered more complexity and increased pilot/computer interaction and workload with aviation accident rate unchanged for the past decade. Cockpit interactions would be safer and more efficient thorugh Voice Communication. Though Voice Recognition systems are becoming widely used, in flight environment conditions usage has been limited due to the unique challenges of elevated noise levels, specific cockpit lexicon, limited cockpit hardware, and lack of standardization.  SouthernAir Aviation Inc. has developed a NextGen Voice Activated Cockpit Management system with applications for flight procedures, emergency procedures, control of aircraft systems and flight management systems.  From simple to complex architectures, the system syncronizes software applications and aircraft systems in a unified model of both language and safety critical development environment to voice activate functions using NextGen Voice Recognition with heuristic pilot response.  Procedures are enabled through wireless Bluetooth connection or wired communication. Additional tools of the system include a novel HMM Model comprising a decision management algorithm and synthetic lexicon for parsing and contiguous recognition.  All the performance requirements are met within a 2% time-slice of a 700MHz Power PC processor and within 1 GB of memory.  Unique key capabilities include: Automatic Lexicon Development, Phonetic Distance Analysis, Coarticulation Handling, Accent Tolerability.  The NextGen advanced performance relies on allophone parsing and reduced recognition error with data processing in real-time, ideal for critical emergency situations. This system is remarkable in that it achieves very high recognition rates (98%) with a very large command set (131,000 unique words and thousands of word combinations).We gratefully acknowledge NASA SBIR Phase I Support.","Immediate NASA applications of our Voice Activated Cockpit Management Systems are: flight management testing, cockpit simulation and certification studies of the Aeronautics and Human-In-The-Loop Programs at NASA Langley Research Center, and potential for cockpit integration of voice function into rotary wing, and high speed wing vehicles with applicability into the studies developed by the Airspace Systems and the Aeronautics Test Programs in addition to the fixed-wing vehicle cockpit of the Aviation Safety Program at NASA ARMD Center.  Applications of SAA Inc. Voice Recognition Technology and Voice Activated Cockpit Management Systems to NASA Technology Taxonomy Mapping includes Air Transportation and Safety, Autonomous Systems and Autonomous Control, Attitude Determination and Control, Avionics Control and Monitoring, Command and Control, Computer Systems Architectures, Condition Monitoring, Knowledge Management, Operating Systems, Process Monitoring and Control, Sequencing and Scheduling, Transport/Traffic Control.","Non-NASA Commercial and General Aviation Applications of NextGen SAA Inc. Voice Activated Cockpit Management Systems into small, medium and large aircraft include Voice Activated NextGen - Emergency Systems; - Instrument Systems (ILS, LOC, GPS, RNAV) and TACAN Control; - Communications Systems Control; - Frequency Selection; - Targeting and Assignment; - Flight Plan Entry and Automated Navigation Control; - Autopilot Control; - Automated Weather Control; - System Information Requests and Control; - Lights Control; - Transponder entry and Control to name a few.  All these applications entitle development of additional Software and Product upgrades via SD storage cards.  Non-NASA Federal Government Applications of NextGen Voice Activated Cockpit Management Systems developed by SAA Inc. include DOD and FAA Flight Training Programs, Education Programs, and Mission Programs including aircraft fleet. Some education management applications include: Public School Students and University Students.Voice Activated Cockpit Management Systems advance the boundaries of aeronautical knowledge for the benefit of the Nation and the broad aeronautics community: partners in academia, industry, and government agencies. Our integrated systems interface with multiple emerging applications and revolutionary concepts enabling radical change to both the airspace system and the aircraft through advanced levels of automated support and efficiency to support the NextGen vision.","Air Transportation & Safety; Algorithms/Control Software & Systems (see also Autonomous Systems); Architecture/Framework/Protocols; Attitude Determination & Control; Autonomous Control (see also Control & Monitoring); Characterization; Command & Control; Computer System Architectures; Data Acquisition (see also Sensors); Data Fusion; Data Input/Output Devices (Displays, Storage); Data Modeling (see also Testing & Evaluation); Data Processing; Hardware-in-the-Loop Testing; Lifetime Testing; Man-Machine Interaction; Models & Simulations (see also Testing & Evaluation); Operating Systems; Process Monitoring & Control; Programming Languages; Project Management; Prototyping; Quality/Reliability; Sequencing & Scheduling; Simulation & Modeling; Software Tools (Analysis, Design); Support; Transport/Traffic Control; Verification/Validation Tools"
12-2 A1.03-8451,NNX13CL14P,Flight Deck Interface Technologies for NextGen,A Formal Approach to User Interface Design Using Hybrid System Theory,"Optimal Synthesis, Inc.","95 First Street, Suite 240, Los Altos, CA 94022 - 2777",(650) 559-8585,Bong-Jun Yang,jun.yang@optisyn.com,"95 First Street, Suite 240, Los Altos, CA 94022 - 2777",(650) 559-8585  Extension :118,P. K. Menon,menon@optisyn.com,"95 First Street, Suite 240, Los Altos, CA 94022 - 2777",(650) 559-8585  Extension :101,3,6,"Based upon the feasibility demonstrated in the Phase I research, Optimal Synthesis Inc.(OSI) proposes to develop a software tool that can be used validate aircraft flight deck user interfaces over the entire flight envelope. The approach is based on a mathematical formalism derived from hybrid systems theory. The correctness of information content in user interfaces is analyzed by a special observability test that takes into account of the limitations in human cognition and psychology. A possible mismatch between an operational mode perceived by the human operator and the one active in the aircraft is detected using an algorithm that compares the inferred intent of the human operator to that of the machine. Metrics-based performance evaluation will be carried out to demonstrate the benefits of the prototype software developed under the Phase II research.  The feasibility of employing the software on the flight deck as a real-time pilot aid will also be analyzed in the Phase II research.","The software developed under the proposed research can support Automated Discovery of Previously Unknown Precursors to Aviation Safety, Automation Design Tools, Assurance of Flight Critical Systems, Advanced Flight-Deck Operations and Human-Computer Interactions tasks under the Aviation Safety Program. Additional programs to which the software can contribute, include Unmanned Aerial Systems integration into the National Air Space, the Automax concept, and Single Pilot Operations under the NextGen Airspace Operations program.",The technologies and the software developed under the proposed research will be applicable to FAA for certifying future interface. Analysis methodologies developed under the proposed research will be useful to NTSB in flight accident investigation by detecting cognitive mismatches in a flight data record. These technologies can be used by companies developing flight deck technologies for use in the next-generation commercial and military aircraft. Other applications of these technologies are in the design of hospital equipment and human-robot workstations.,Air Transportation & Safety; Avionics (see also Control and Monitoring); Command & Control; Intelligence; Knowledge Management; Man-Machine Interaction; Perception/Vision; Quality/Reliability
12-2 A1.03-9714,NNX13CL15P,Flight Deck Interface Technologies for NextGen,High Resolution Autostereoscopic Cockpit Display,"Dimension Technologies, Inc.","315 Mt Read Boulevard, Rochester, NY 14611 - 1982",(585) 436-3530,Jesse B. Eichenlaub,jbe@dti3d.com,"315 Mt Read Boulevard, Rochester, NY 14611 - 1982",(585) 436-3530,Arnold D. Lagergren,adl@dti3d.com,"315 Mt. Read Blvd., Rochester, NY 14611 - 1982",(585) 436-3530,4,6,"During this Phase II program Dimension Technologies Inc. (DTI) proposes to design and build an autostereoscopic (glasses-free 3D) LCD based aircraft cockpit display that features switchable 2D & 3D operation, full LCD resolution in both 2D and 3D modes, a wide viewing area without head position restrictions, and high brightness.  The display will be configured for installation and testing in a Boeing 787 cockpit simulator for evaluation and testing at the end of Phase II. Given positive results this could be followed by modification and installation in a test aircraft in Phase III.  The display will be based on Rockwell's 15"" flight deck displays currently in use and be designed to fit inside the existing display volume envelope.  Code will be written to allow Boeing's existing simulator software to produce 3D images on DTI's displays.  Presentation of images in 3D should increase the pilot's ability to extract information, particularly situational awareness from cluttered displays, as indicated by various studies at NASA and the US Air Force.  Boeing has agreed to partner with DTI in Phase II.","After initial discussions and a meeting with NASA, it was apparent that NASA's interest in this project is primarily for purposes of improving commercial transport aircraft safety, as opposed to any internal NASA project or NASA aircraft or spacecraft. Nevertheless, the technology will potentially be of benefit in NASA aircraft and spacecraft cockpits for purposes of increasing situation awareness,  as well as in NASA telerobotic applications, such as the space station based manipulator arm and Robonaut, where display in stereoscopic 3D is of proved benefit for human controlled robot systems.  During discussions NASA personnel have also expressed interest in glasses free 3D for workstation applications, especially those that require viewing of complex representations of data sets like atmospheric information obtained by satellites.  Scientific workstation applications have long been recognized as a potential market for glasses free 3D displays, and therefore is one of the markets that DTI will seek to license into.  DTI's strategy is to license to major monitor manufacturers who can commercialize and mass produce 3D displays with DTI technology inside, making them available to NASA and others at low cost for a variety of applications.","DTI is partnering with Boeing on the Phase II project for development of a prototype glasses free 2D/3D display for testing in their 787 cockpit simulator during Phase II/Phase III, ideally leading to licensing.  The display developed under Phase II could have wider application in the avionics industry - a successful Phase III program could result in the opening of other avionics markets.  The US Army Tank Command also has an interest in 3D technology for remote controlled vehicle use.An automotive company and a point of sale display company have already expressed interest in DTI's full resolution face tracking display technology. The following long term potential markets have been investigated by DTI:Patient Education - The 150,000 dentists in the U.S. could generate an annual volume of 10,000 3D units.  Student Education - Market Research has determined that 3D content yields a 30% higher retention rate than 2D content in an education environment. This could lead to a annual demand for 250,000 3D monitors for each of the following five years. Medical - 3D visualization systems in the operating rooms are estimated to be a $2 billion market annually, including stereoscopic endoscope systems.   Consumer games and Television - The home television market is expected to have great demand for glasses-free 3D.  Variations on DTI's face tracked display that could providing 3D to more than one person are a potential solution.",Air Transportation & Safety; Display
12-2 A1.06-9011,NNX13CL53P,Assurance of Flight-Critical Systems,A Scalable Semantics-Based Verification System for Flight Critical Software,"Runtime Verification, Inc.","60 Hazelwood Drive, Suite 230-2, Champaign, IL 61822 - 7460",(217) 418-0418,Patrick Meredith,pmeredit@gmail.com,"60 Hazelwood Drive, Suite 230-2, Champaign, IL 61822 - 7460",(217) 418-0418,Patrick Meredith,patrick@runtimeverification.com,"60 Hazelwood Drive, Suite 230-2, Champaign, IL 61822 - 7460",(217) 418-0418,4,7,"Flight-critical systems rely on an ever increasing amount of software—the Boe- ing 777 contains over 2 million lines of code. Most of this code is written in the C programming language. We need a scalable static formal program verification tool that is able to prove the functional correctness of flight-critical software, limiting any failure of flight critical software to hardware faults.This project seeks to leverage the matching logic verification framework. Matching logic is generic in an operational semantic of a given programming language, so we also seek to give a semantics of a subset of C, called CIL, which is guaranteed to be deterministic. While we already have a semantics for the entirety of C, CIL is more representative of flight-critical software, and the simpler, deterministic semantics will result in a more efficient, and thus more scalable, static program verification tool. We are also building a new unification- based rewrite engine that will result in a more powerful version of the Matching Logic Framework.  In order to make the tool more commercially feasible, we will develop new techniques in pattern inference, so that loop invariants and some pre/post conditions can be determined automatically.  We will perform a thorough evaluation of our tool on a large-scale piece of software with similar characteristics to a flight system.","We anticipate that our tool and definition of CIL will beused in verification of all safety and mission critical flight systems.  NASAhas shown themselves to be very amenable to formal methods techniques in thepast.  Our technical contact within NASA expects such a tool to be used on vehiclestargeted at manned space missions as well as mission critical systems such as the rockets, probes, space telescopes, andlanders/rovers.","TAM for our work would be the entire software industry. Realistically, we do not have the manpower to target the entirety of the software industry. A more reasonable SAM would be those companies in the software industry where correctness is key, either because bugs are very expensive to fix (Microsoft) or where bugs are disastrous to life and limb (NASA/Boeing/medical device manufacturers). We feel that our realistic SOM is larger software development corporations that would be willing to pay larger amounts for site licenses as well as be willing to hire on verification engineers from our Runtime Verification, Inc. This will allow us to leverage our smaller number of employees in a way that results in maximal possible profits, versus marketing to smaller software developers, which will be less willing to pay for site licenses. We can move into that segment of the market later, once Runtime Verification is able to grow. Initially, we would like to focus on Aerospace companies (Boeing), Automotive (Toyota-ITC, DENSO), Finance (2Sigma), Microsoft (in particularly Windows and Office), Apple (OS X), the US Military, NSA, the large hadron collider, and Facebook (they have already shown themselves amenable to formal methods tools).","Algorithms/Control Software & Systems (see also Autonomous Systems); Software Tools (Analysis, Design); Verification/Validation Tools"
