Proposal Number,Phase 1 Contract #,Subtopic Title,Proposal Title,Small Business Concern_Firm,Small Business Concern_Address,Small Business Concern_Phone,Principal Investigator_Name,Principal Investigator_E-mail,Principal Investigator_Address,Principal Investigator_Phone,Business Official_Name,Business Official_E-mail,Business Official_Address,Business Official_Phone,TRL_Begin,TRL_End,Technical Abstract,Potential NASA applications,Potential non-NASA applications,Technology Taxonomy Mapping
12-2 H2.01-9033,NNX13CC30P,Cryogenic Fluid Management Technologies,"A Reliable, Efficient Cryogenic Propellant Mixing Pump With No Moving Parts","Creare, Inc.","P.O. Box 71, Hanover, NH 03755 - 3116",(603) 643-3800,Weibo Chen,wbc@creare.com,"P.O. Box 71, Hanover, NH 03755 - 3116",(603) 643-3800  Extension :2425,Robert J Kline-Schoder,contractsmgr@creare.com,"P.O. Box 71, Hanover, NH 03755 - 3116",(603) 643-3800  Extension :2487,3,4,"Refueling spacecraft in space offers tremendous benefits for increased spacecraft payload capacity and reduced launch cost.  However, there are several key challenges with space refueling associated with the storage and handling of liquid cryogens in space.  To meet these challenges, we propose to develop a reliable, compact, efficient cryogenic mixing pump with no moving parts.  The mixing pump will prevent thermal stratification of the cryogen and simplify pressure control for storage tanks.  The mixing pump uses an innovative thermodynamic process to generate fluid jets to promote fluid mixing, eliminating the need for mechanical pumps.  Our innovative mechanism will be able to self-prime and generate a high-pressure rise.  The device will significantly enhance the reliability of pressure control systems for storage tanks.  In Phase I, we demonstrated the feasibility of our approach through building and testing a proof-of-concept mixing pump, optimizing the mixing pump design by analysis, and developing a preliminary layout design of a prototype pump.  In Phase II, we will build and test a laboratory-scale cryogenic mixing pump, demonstrate its performance in a representative cryogenic environment, and deliver the pump to a NASA research lab for further evaluation.",The technology developed in this project will enable reliable long-term and short-term cryogenic propellant storage in space for refueling.  The mixing pump will enable effective pressure control for cryogenic tanks by maintaining a uniform fluid temperature.  Its high reliability will significantly enhance the effectiveness of the pressure control mechanism.  The device developed in this project can also be used as a two-phase cryogenic pump with no impellers or pistons to enable reliable cryogen transfer for space applications.  The technology also has application in low-G propellant liquid mass gauging by serving as a reliable compression mass gauge.,"The technology developed in this project has applications in reliable two-phase pumps for cryogenic fluids and refrigerant flows.  Applications include cryogenic two-phase cooling systems for superconductors.  The technology also has applications in thermal management systems for advanced electronics and photonics systems, as well as advanced environmental control systems for future military vehicles.",Cryogenic/Fluid Systems
12-2 H2.01-9448,NNX13CG09P,Cryogenic Fluid Management Technologies,High Speed Compressor for Subcooling Propellants,"Barber-Nichols, Inc.","6325 West 55th, Arvada, CO 80002 - 2707",(303) 421-8111,Jason Preuss,jpreuss@barber-nichols.com,"6325 West 55th Ave, Arvada, CO 80002 - 2707",(303) 421-8111,Jeff Shull,jshull@barber-nichols.com,"6325 West 55th, Arvada, CO 80002 - 2707",(303) 421-8111,4,6,"The most promising propellant subcooling  systems for LH2 require compression systems that involve development of significant head.  The inlet pressure for these systems is typically on the order of 1.4 psia with a discharge pressure requirement above atmospheric pressure.  In the past this has required multiple stages of compression by machines operating at high speeds on ball bearings.  The bearing life in these machines was at most a few hundred hours.  While this is feasible to use for a proof of concept test system, it is not acceptable for the H2 compressors in application at the launch pad.  It is desired to replace these grease-packed ball bearings with foil bearings to greatly increase compressor life.  Additionally higher speed can eliminate several stages thus reducing complexity and cost of the system.  If this technology proves feasible it could finally make densified LH2 propellant a reality for future launch and space applications.","The potential applications for this technology at NASA are widespread.  In addition to propellant densification for use in liquid rocket engines at launch, there are also applications that involve long term in-space storage of the propellants to be used on vehicles over months or years.  By subcooling the propellant it drastically reduces boil-off of the cryogens over time and thus improves storage life.  The applications include on-vehicle propellant storage for long range mission and propellant depots that are planned for space.  Liquid cryogenic injection at the foil bearing also makes sense for rocket engine turboumps.  This bearing innovation for LOX and LH2 turbopumps could greatly increase life over the ball bearings currently used which will be especially appealing for the long range missions planned for the future.",There are also numerous applications outside of NASA.  Numerous private companies are currently designing and building rockets that use turbopumps.  Many of these applications are seeking longer bearing life and would greatly benefit from this technology.  Grease-packed ball bearing cryogenic H2 circulators are currently in use for neutron sources and flux reactors at facilities around the world.  In each of these applications longer bearing life along with the possibility of attaining even higher speeds are needed.   There are also numerous other applications involving cryogenic He expanders and compressors in superconducting magnet cooling and refrigeration that could greatly benefit from this technology.,Cryogenic/Fluid Systems; Fuels/Propellants; Hardware-in-the-Loop Testing; Simulation & Modeling
12-2 H2.02-8607,NNX13CC33P,In-Space Propulsion Systems,Low-Cost Manufacturing Technique for Advanced Regenerative Cooling for In-Space Cryogenic Engines,"Analytical Services, Inc. (ASI)","350 Voyager Way, Huntsville, AL 35806 - 3200",(256) 562-2100,Thomas Haymond,Thomas.Haymond@asi-hsv.com,"350 Voyager Way, Huntsville, AL 35806 - 3200",(256) 562-2157,Sandra Fossett,sandra.fossett@asi-hsv.com,"350 Voyager Way, Huntsville, AL 35806 - 3200",(256) 562-2165,3,6,"The goal of the proposed effort is to use selective laser melting (SLM, an additive manufacturing technique) to manufacture a hot fire-capable, water-cooled spool piece that features an advanced regenerative cooling technique that combines high heat flux performance with low pressure drop. SLM enables us to ""print"" the spool piece in days, despite the complexity of the regenerative liner's inherent flow passage complexity. This reduction in manufacturing lead time, combined with the fact that SLM manufacturing costs are driven in large part by the amount of raw powder used during fabrication, results in a substantial cost reduction for future regeneratively-cooled rocket engines. Additionally, the proposed advanced regenerative cooling approach features a heat-pickup efficiency that is at least two orders of magnitude higher than traditional milled channel liners and/or brazed tube bundle chambers.As a result of our Phase I activity and confidence in our commercialization path, we will be making a capital investment to stand up an SLM manufacturing capability in house.  We plan to augment that investment with an internally-funded trade study that we will use to derive main combustion chamber performance requirements for a future expander cycle engine.  Those requirements will feed into Phase II design requirements and, ultimately, to supporting our commercialization opportunity presented by the Affordable Upper Stage Engine Program.","The Affordable Upper Stage Enginer (AUSE) is our primary NASA application.  The upper stage engine, which will replace the RL10, will benefit from our SLM-manufactured MCC in three ways.  First, SLM is known to reduce the cost of component manufacture by 50-70%, which will help satisfy affordability requirements.  Second, the pressure drop penalty incurred by using our advanced cooling approach is reduced by about an order of magnitude over current state of the art, which will reduce turbompump requirements, which will also contribute to lower cost.  Third, our approach provides a dramatic increase in heat flux to the regenerative propellant, which will enable an increase in expander cycle engine performance, by increasing its potential for doing work across the turbine.  The Space Launch System (SLS) Program is another opportunity, particularly since the core stage will use the RS-25 engine, a staged combustion cycle that will likewise benefit from reductions in cooling jacket pressure drop. The Altair ascent and descent engines would also both benefit from our technology.","We are already actively pursuing a non-NASA opportunity with the Missile Defense Agency (MDA), which is forced to fly very expensive foreign missile systems as targets for interept missions.  Today, these targets cost about $40M per mission.  We have identified a low cost target that we can upgrade with a version of our SLM-manufactured advanced combustion chamber that will improve the range of that target, such that it can be used instead of the expensive foreign systems.  If we are successful with the design, development and testing, MDA could fly our targets and save a massive $39M per intercept test.",Active Systems; Atmospheric Propulsion; Heat Exchange; Launch Engine/Booster; Metallics; Processing Methods; Spacecraft Main Engine; Surface Propulsion
12-2 H2.02-8782,NNX13CM07P,In-Space Propulsion Systems,Fine Grained Tungsten Claddings for Cermet Based NTP Systems,"Plasma Processes, LLC","4914 Moores Mill Road, Huntsville, AL 35811 - 1558",(256) 851-7653,John Scott O'Dell,scottodell@plasmapros.com,"4914 Moores Mill Road, Huntsville, AL 35811 - 1558",(256) 851-7653  Extension :104,Timothy N. McKechnie,timmck@plasmapros.com,"4914 Moores Mill Road, Huntsville, AL 35811 - 1558",(256) 851-7653  Extension :103,3,4,"In October 2011, NASA initiated the Nuclear Cryogenic Propulsion Stage (NCPS) program to evaluate the feasibility and affordability of Nuclear Thermal Propulsion (NTP).  A critical aspect of the program is to develop a robust, stable nuclear fuel.  One of the nuclear fuel configurations currently being evaluated is a cermet-based material comprised of uranium dioxide (UO2) particles encased in a tungsten matrix (W).  To prevent excessive fuel loss from reaction with the hot hydrogen gas and uranium hydride formation, dense, fine-grained tungsten claddings are needed.  Recently, advanced additive manufacturing techniques (EL-Form and Vacuum Plasma Spray Forming) have been developed that enable the deposition of coatings and near-net-shape refractory metal components with high density and tailored microstructures.  The Phase I investigation produced fine-grained W claddings using EL-Form and VPS processing techniques.  Testing showed the W claddings were well bonded to surrogate nuclear fuel element materials, and the W claddings were vacuum tight.  During Phase II, the techniques developed during Phase I will be optimized, and W claddings on full size cermet fuel elements will be developed and characterized.  Subscale and full-size test articles will be produced and delivered to NASA-MSFC for hot hydrogen testing in the Compact Fuel Element Environment Test (CFEET) facility and the Nuclear Thermal Rocket Element Environment Simulator (NTREES).","NASA applications that would directly benefit from this technology include Nuclear Thermal Propulsion (NTP) and Nuclear Electric Propulsion (NEP).  Space nuclear power and propulsion are game changing technologies for space exploration.  Initial NTP systems will have specific impulses roughly twice that of the best chemical systems, i.e., reduced propellant requirements and/or reduced trip time.  Currently, NASA's Nuclear Cryogenic Propulsion Stage (NCPS) project is working to demonstrate the viability and affordability of NTP.  The proposed Phase II effort would greatly assist NASA with achieving the goals of the NCPS project.  Potential NASA missions include rapid robotic exploration missions throughout the solar system and piloted missions to Mars and other destinations such as near earth asteroids.","Both government and commercial entities in the following sectors use advanced high-temperature materials for the following applications: coatings, defense, material R&D, nuclear power, aerospace, propulsion, automotive, electronics, crystal growth, and medical.  Targeted commercial applications include net-shape fabrication of refractory rocket nozzles, crucibles, heat pipes, fuel rods, and propulsion subcomponents; and advanced coating systems for x-ray targets, sputtering targets, turbines, and rocket engines.","Ceramics; Characterization; Coatings/Surface Treatments; Conversion; Destructive Testing; Fuels/Propellants; Generation; Joining (Adhesion, Welding); Metallics; Processing Methods; Prototyping; Quality/Reliability; Sources (Renewable, Nonrenewable); Spacecraft Main Engine"
12-2 H2.02-9050,NNX13CC34P,In-Space Propulsion Systems,"Lifetime Improvement of Large Scale Green Monopropellant Thrusters via Novel, Long-Life Catalysts","Busek Company, Inc.","11 Tech Circle, Natick, MA 01760 - 1023",(508) 655-5565,Michael Tsay,mtsay@busek.com,"11 Tech Circle, Natick, MA 01760 - 1023",(508) 655-5565,Judy Budny,judy@busek.com,"11 Tech Circle, Natick, MA 01760 - 1023",(508) 655-5565,4,5,"Busek proposes to develop and life-test a flight-weight, 5N class green monopropellant thruster in Phase II. The most important feature that sets this thruster apart from other similar devices will be the use of an innovative, long-life catalyst. This proprietary catalyst, constructed without any bed plate or ceramic substrate, has the potential to suppress catalyst-related performance degradation problems that often plague monopropellant thrusters. The Phase II thruster in essence will be a matured version of the highly-successful Phase I prototype, with the addition of high-temperature nozzle material.  To further demonstrate the design's scalability, a 100N class thruster will be developed and demonstrated at the end of Phase II.","Potential NASA applications of both the 5N and 100N green monopropellant thrusters include missions to low Earth orbits and beyond.  Near-term examples are the Geostationary Operational Environmental Satellite (GOES) at GEO, the Wide Field Infrared Survey Telescope (WFIRST) at GEO, the International X-ray Observatory (IXO) at L2, and the next Mars robotics mission scheduled for 2020 launch.  As with state-of-the-art reaction control rockets Busek's green monopropellant thrusters are radiation-cooled and restart-able, making them a simple yet reliable propulsion option.  In addition, the green propellant's storability and low-toxicity will be attractive for NASA's future manned spaceflight.  Without the need for excessive safety measures, overall operational cost for the manned missions will be reduced.","The market size for green monopropellant thrusters is very large.  In addition to NASA, all branches of the military are interested in deploying them for tactical or in-space applications.  The non-toxic storable feature of the propellant enables preloaded propulsion systems that can accommodate rapid launch operations.  Because Busek's thrusters have the potential for extended life without performance degradation, developers of GEO communication satellites will likely consider them for both reaction control and primary propulsion.  This versatility will help broaden market access.  A successful Phase II program will lead to direct sales or licensing of the thrusters and the associated catalyst technology.",Fuels/Propellants; Maneuvering/Stationkeeping/Attitude Control Devices
12-2 H2.03-8644,NNX13CS02P,Advanced Technologies for Propulsion Testing,Polymer Derived Rare Earth Silicate Nanocomposite Protective Coatings for Nuclear Thermal Propulsion Systems,"Nanosonic, Inc.","158 Wheatland Drive, Pembroke, VA 24136 - 3645",(540) 626-6266,Vince Baranauskas,vince@nanosonic.com,"158 Wheatland Drive, Pembroke, VA 24136 - 3645",(540) 626-6266,Melissa Campbell,mcampbell@nanosonic.com,"158 Wheatland Drive, Pembroke, VA 24136 - 3645",(540) 626-6266,4,7,"Leveraging a rapidly evolving state-of-the-art technical base empowered by Phase I NASA SBIR funding, NanoSonic's polymer derived rare earth silicate EBCs will provide a paradigm breaking advancement for NTPs by extending the operational utility of NTP rocket thrust chambers and nozzles. Unlike competing deposition technologies severely limited by substrate size and dimensions, NanoSonic's rare earth silicate coatings may be spray deposited under ambient conditions onto large area complex substrates and converted to mechanically robust, thermally insulative EBCs on a production basis.  In fact, legacy spray equipment employed for hardcoat deposition within the marine, automotive and aerospace industries has been used for successful EBC deposition. Simulated NTP testing completed by the University of Washington on coated Inconel 625 substrates indicate five candidate EBCs have exceptional environmental, dimensional, and adhesive durability within flow conditions representative of NTP rocket engines. In fact, zero spallation, erosion, or any other form of coating degradation was observed at the thermal limit of testing of 1,950 C. All candidate resins may be transitioned to 200-gallon batch production quantities within an established manufacturing infrastructure.","NanoSonic's yttrium silicate coatings will serve as a next-generation alternative to line-of-sight vacuum assisted EB-PVD coatings for lifetime and performance gains  on nozzle, throat and core rocket engine components. Since the technology is spray deposited using legacy HVLP equipment under ambient conditions, literally any rocket propulsion component may be coated during a continuous or semi-continuous process during vehicle construction, as well as retrofitted on existing large area, irregularly shaped structures in need of high temperature thermal, corrosive and erosion protection.","Broad secondary commercial and DoD applications will be continuously sought for NanoSonic's polymer derived rare earth silicate EBCs.  Of particular interest is the foreseen return-on-investment for aerospace, marine and automotive engine components and subcomponents integrating NanoSonic's EBCs for enhanced thermal insulation, corrosion and erosion durability.  Additionally, NanoSonic's polymer derived EBC coating technology may serve as an integral enabling technology for the use of fiber reinforced polymeric composites in closer proximity to engine systems by providing highly efficient, thin (<75 microns) insulative coatings.","Airship/Lighter-than-Air Craft; Atmospheric Propulsion; Characterization; Coatings/Surface Treatments; Composites; Entry, Descent, & Landing (see also Astronautics); Entry, Descent, & Landing (see also Planetary Navigation, Tracking, & Telemetry); Extravehicular Activity (EVA) Propulsion; Fire Protection; Isolation/Protection/Shielding (Acoustic, Ballistic, Dust, Radiation, Thermal); Launch Engine/Booster; Nanomaterials; Passive Systems; Polymers; Processing Methods; Space Transportation & Safety; Spacecraft Design, Construction, Testing, & Performance (see also Engineering; Testing & Evaluation); Surface Propulsion; Vehicles (see also Autonomous Systems)"
12-2 H3.02-9063,NNX13CJ21P,Environmental Monitoring and Fire Protection for Spacecraft Autonomy,"A First Response Crew Mask for Ammonia, Hydrazine and Combustion Products","TDA Research, Inc.","12345 West 52nd Avenue, Wheat Ridge, CO 80033 - 1916",(303) 422-7819,Gokhan Alptekin,galptekin@tda.com,"12345 West 52nd Avenue, Wheat Ridge, CO 80033 - 1916",(303) 940-2349,John D. Wright,krhodus@tda.com,"12345 West 52nd Avenue, Wheat Ridge, CO 80033 - 1916",(303) 940-2300,3,6,"The increasing frequency of International Space Station (ISS) egress operations contaminates the spacecraft environment with propellant residues (such as anhydrous hydrazine) and their decomposition by-products, as well as coolants such as ammonia and Freon.  NH3 and N2H4 have a 24 hour Spacecraft Maximum Allowable Concentration (SMAC) of 7 ppm and 0.3 ppm, respectively.TDA Research Inc. is developing a new adsorbent that can remove these contaminants to sub ppmv concentrations with high activity and capacity. The sorbent can be integrated as a thin layer into an existing cartridge used in the ISS first response crew mask; the new media will greatly extend the capability to protect against the NH3 and hydrazine for extended duration under high contaminant challenges, without undermining the ability of the cartridge to filter out other combustion by-products.In Phase I, we successfully completed all proof-of-concept demonstrations at the bench-scale elevating the TRL to 3. The new adsorbent can provide over 1,400 minutes of protection when challenged with 50 ppmv NH3 and over 450 hrs with 1 ppmv anhydrous N2H4, even at a bed aspect ratio as low as 0.1 and at gas-solid contact times as low as 0.11 sec.  The NH3 and N2H4 capacity of the sorbent exceeds 1.8% wt. and 1.4% wt., respectively, with bed outlet concentrations maintained at less than 40 ppbv.In Phase II, we will continue to optimize the sorbent formulations and scale-up the production.  We will design and fabricate full-scale experimental prototype cartridges at TDA to support demonstrations in an environmental chamber using a breathing apparatus.  Based on the results, we will design and fabricate high fidelity cartridges based on the flight qualified ISS Fire Recovery Respirator Cartridge and complete high fidelity demonstrations in an environmental chamber to fully demonstrate its capability (non-human testing at TRL 6). These will be provided to NASA for additional testing and demonstrations.","The main product of our research  of our research to NASA is a highly capable cartridge to be used in a first response crew mask to protect the astronaut against NH3 and hydrazine, as well as other combustion by-products.  The new cartridge will extend the capabilities of the current cartridge used at the ISS and provide further protection to the crew person against an ammonia and/or hydrazine challenge.","There is a potential commercial opportunity for our technology in commercial safety devices and personal protection systems.  We estimated a total market in the U.S. and Europe could exceed 250,000 units per year, assuming an average shelf life of two years for the respirator.  The new adsorbent may also find applications in preventing ""ammonia slip"" from Selective Catalytic Reduction based NOx  Emission Control Units used in power plants.",Fire Protection; Protective Clothing/Space Suits/Breathing Apparatus
