Proposal Number,Phase 1 Contract #,Subtopic Title,Proposal Title,Small Business Concern_Firm,Small Business Concern_Address,Small Business Concern_Phone,Principal Investigator_Name,Principal Investigator_E-mail,Principal Investigator_Address,Principal Investigator_Phone,Business Official_Name,Business Official_E-mail,Business Official_Address,Business Official_Phone,TRL_Begin,TRL_End,Technical Abstract,Potential NASA applications,Potential non-NASA applications,Technology Taxonomy Mapping
12-2 H7.01-9290,NNX13CA32P,Ablative Thermal Protection Systems,Recession-Tolerant Sensors for Thermal Protection Systems,"MesoScribe Technologies, Inc.","7 Flowerfield, Suite 28, St. James, NY 11790 - 1514",(631) 686-5710,Rob Greenlaw,rgreenlaw@mesoscribe.com,"7 Flowerfield, Suite 28, St. James, NY 11790 - 1514",(714) 894-8400,Jeff Brogan,jbrogan@mesoscribe.com,"7 Flowerfield, Suite 28, Saint James, NY 11780 - 0000",(631) 686-5710  Extension :1,3,5,"The Phase II project will develop a suite of diagnostic sensors using Direct Write technology to measure temperature, surface recession depth, and heat flux of an ablative thermal protection system (TPS) in real time, which can be integrated to support TPS evaluation and in-situ diagnostics during planetary entry.  Standalone heat flux sensors and those fabricated by direct deposition will be developed and demonstrated for integration within TPS materials for use in extreme re-entry conditions.  The intent is to use the sensors for real time temperature/heat flux measurements to validate new materials and systems, as well as for flight structures where space and accessibility are limited.  Methods for incorporating thermocouples, heat flux and recession sensors using Direct Write technology will be developed to provide accurate sensing capabilities.  Notably, recession tolerant heat flux sensors will be designed and fabricated to demonstrate feasibility of this new heat flux sensor technology and subsequent instrumentation capability for TPS.","NASA has communicated a need for advanced TPS sensing to improve laboratory performance evaluation of new TPS materials as well as in-situ monitoring for manned and unmanned missions.  Testing and evaluation of new TPS materials represents a significant activity in the planning of all missions.  Typically, the TPS requirements are fairly well identified with respect to heat flux profile, duration, atmosphere, etc. based upon the specific mission.  However, ruggedized sensors for monitoring heat flux in-situ are not yet available for TPS validation or fielding.  The Orion capsule, being developed by NASA under the MPCV (Multi-Purpose Crew Vehicle) program, calls for a number of TPS sensors where real time heat flux data would be invaluable.  Challenging opportunities exist at JPL in developing TPS systems for unmanned sample return missions from both a Near Earth Object (NEO) and Mars.  The competing requirements for low mission weight and increased TPS performance due to increased thermal loads from higher re-entry speeds results in a need for improved sensors for TPS development.","Opportunities for sensor integration onto manned and unmanned vehicles not only exist within NASA, but are becoming more prevalent in the commercial sector including space travel as well as other areas.  Sensors are needed to monitor the health and condition of the heat shield during re-entry for the COTS and ccDEV programs.  Outside of space applications, harsh environment sensors are in high demand, spanning a range of industries including power generation, commercial and military turbo-machinery, aerospace structures, and solar.  DoD applications for harsh environment diagnostic sensors are primarily aerospace and rotorcraft, specifically seeking instrumentation for short term testing at the component-level and long-term monitoring/prognostics as part of a comprehensive health management solution.  Application demand is driven by gas turbine engine designers for industrial power generation equipment (gas turbine, steam, boilers), aero propulsion systems (gas turbine and hypersonic engine components), aerospace, chemical processing, oil & gas, and other commercial applications.  Diagnostics are also sought for air-breathing scramjets and other hypersonic vehicles (e.g. sounding rockets) to enable integrated condition monitoring and advanced prognostic capabilities.","Ablative Propulsion; Condition Monitoring (see also Sensors); Diagnostics/Prognostics; Entry, Descent, & Landing (see also Planetary Navigation, Tracking, & Telemetry); Health Monitoring & Sensing (see also Sensors); Isolation/Protection/Shielding (Acoustic, Ballistic, Dust, Radiation, Thermal); Manufacturing Methods; Materials (Insulator, Semiconductor, Substrate); Smart/Multifunctional Materials; Spacecraft Design, Construction, Testing, & Performance (see also Engineering; Testing & Evaluation); Thermal"
12-2 H8.03-9492,NNX13CC44P,Space Nuclear Power Systems,Turbo-Brayton Power Converter for Spaceflight Applications,"Creare, Inc.","P.O. Box 71, Hanover, NH 03755 - 3116",(603) 643-3800,Jeffrey Breedlove,jfb@creare.com,"P.O. Box 71, Hanover, NH 03755 - 3116",(603) 643-3800  Extension :2442,Robert Kline-Schoder,contractsmgr@creare.com,"PO Box 71, Hanover, NH 03755 - 0071",(603) 643-3800  Extension :2487,3,4,"Future NASA space missions require advanced systems to convert thermal energy into electric power.  These systems must be reliable, efficient, and lightweight.  In response, we propose to develop a turbo-Brayton power converter with high efficiency and specific power.  The converter will use gas bearings to provide reliable, maintenance-free, long-life operation.  It will also consist of discrete components that can be packaged to fit optimally with other subsystems, and its continuous gas flow can communicate directly with remote heat sources and heat rejection surfaces without ancillary heat transfer components and intermediate flow loops.  Creare is well suited to succeed because we have a long history of developing advanced turbomachines, heat exchangers, and Brayton systems for challenging spaceflight applications.  We completed detailed analyses, trade studies, fabrication trials, and preliminary designs for the components and converter assembly during Phase I, and we now plan to fabricate and test a breadboard converter during Phase II.",There are many potential NASA applications for our converter technology.  The converter can be sized for coupling with radioisotope heat sources to support low-power devices such as space exploration probes and unmanned surface rovers.  Our converter can also be sized for significantly greater power levels and coupled with fission reactors to support larger spacecraft as well as manned exploration of the lunar and Martian surfaces.  Other applications include nuclear electric propulsion and space station power systems.  Alternative heat sources include concentrated solar radiation.,"Terrestrial versions of our converter can be used to produce electric power for military and civilian applications.  These converters would be coupled with non-nuclear heat sources such as fossil fuel combustion, biofuel combustion, refuse burning, and concentrated solar energy.  The resulting systems can be applied wherever electric generators are currently used.  They will be particularly attractive for mobile applications because they have high specific power.  Their hermetic, closed-loop configuration will also make them desirable in environments that have contaminants such as sand, dirt, and dust, and in environments that are exposed to corrosive substances such as sea water.",Conversion
12-2 H8.03-9876,NNX13CC45P,Space Nuclear Power Systems,Low Cost Radiator for Fission Power Thermal Control,"Advanced Cooling Technologies, Inc.","1046 New Holland Avenue, Lancaster, PA 17601 - 5688",(717) 295-6061,Calin Tarau,Calin.Tarau@1-act.com,"1046 New Holland Ave., Lancaster, PA 17601 - 5606",(717) 295-6066,Jon Zuo,jon.zuo@1-act.com,"1046 New Holland Avenue, Lancaster, PA 17601 - 5606",(717) 295-6061,4,7,"NASA GRC is developing fission power system technology for future space transportation and surface power applications. The early systems are envisioned in the 10 to 100kWe range and have an anticipated design life of 8 to 15 years with no maintenance. A non-nuclear system ground test in thermal-vacuum is planned by NASA GRC to validate technologies required to transfer reactor heat, convert the heat into electricity, reject waste heat, process the electrical output, and demonstrate overall system performance. This SBIR project by ACT will develop a modular single-facesheet Variable Conductance Heat Pipe (VCHP) radiator, operating near 450K, to support the Technology Demonstration Unit (TDU) for surface power. Based on the Phase I results and the experience gained during previous NASA SBIR VCHP radiator programs, ACT and VST will develop in Phase II a low cost high specific power modular radiator for the TDU. New features of this radiator include direct bonding to the titanium condenser and the fact that it is modular and therefore, the CTE mismatch on the manifold direction is eliminated. The modular radiator will consist of 12 clusters of 9 modules each. ACT will design the modular radiator, validate the radiator module, fabricate the heat pipes and test the clusters in ambient conditions before sending them to GRC. VST will further develop the GFRC direct bonding and attach the GFRC fins to all the heat pipes.","The low cost VCHP radiator developed under this Phase I and Phase II program would provide the waste heat rejection system necessary for the non-nuclear TDU to be tested at NASA GRC.  Additional, longer term NASA candidate missions that the low cost VCHP radiator would support are initial power sources for human outposts on the Moon or Mars and nuclear electric propulsion systems (NEP) for Mars cargo transport.  A benefit for Lunar and Martian radiators is that the VCHP can passively accommodate the large swings in environmental conditions between lunar (or Martian) day and night, including long periods at very low temperatures.  In addition, the VCHP can passively accommodate large changes in thermal load, and avoid damage during periods of low thermal load.  The non-condensable gas in the VCHP will also help with start-up during sudden increases in thermal load.","There is a commercial application for high temperature VCHP heat exchangers in fuel cell reformers. In a fuel cell reformer, steam, air and diesel fuel react in a High Temperature Shift (HTS) and a Low Temperature Shift (LTS) reactor to produce as much hydrogen as possible. Feed streams to and from the reactors must be maintained under tight temperature control, typically within 30�C despite a turndown ratio of 5:1 in reactant flow rate.  ACT believes that VCHP heat exchangers can replace the current heat exchanger and control system with a passive system.  The VCHP heat pipes passively adjust the heat removed, to maintain the output stream at a constant temperature. The direct bonding of the single facesheet GFRC to the titanium condenser would allow low cost and mass radiators for atmospheric high altitude applications like waste heat rejection from balloon payloads or from UAV electronics.",Active Systems; Generation; Heat Exchange; Models & Simulations (see also Testing & Evaluation); Passive Systems; Prototyping
12-2 H8.04-8780,NNX13CC46P,Advanced Photovoltaic Systems,Automated High-Volume Manufacturing of Modular Photovoltaic Panel Assemblies for Space Solar Arrays,"Deployable Space Systems, Inc.","75 Robin Hill, Building B2, Goleta, CA 93117 - 3108",(805) 693-1319,Brian Spence,Brian.Spence@DeployableSpaceSystems.com,"75 Robin Hill, Building B2, Goleta, CA 93117 - 3108",(805) 722-8090,Brian Spence,Brian.Spence@DeployableSpaceSystems.com,"75 Robin Hill, Building B2, Goleta, CA 93117 - 3108",(805) 722-8090,3,5,"Deployable Space Systems, Inc. (DSS) will focus the proposed SBIR Phase 2 program on the development and demonstration of an automated robotic manufacturing infrastructure designed to mass-produce DSS's Integrated Modular Blanket Assembly (IMBA) common photovoltaic Standard Power Modules (SPM's). The proposed development and demonstration will implement automated manufacturing processes for CIC-ing, glassing, stringing, laydown, and validation testing of interconnected photovoltaic devices onto an ultra-lightweight IMBA/SPM modular flexible blanket assembly through simple and commercially available pick-and-place robotic manufacturing techniques / equipment.  Robotically automated manufacturing of IMBA/SPM photovoltaic panel assemblies will provide game-changing affordability / cost-savings when compared to current labor intensive manufacturing processes.  Unlike the current industry approach which is only focused on increasing the device area to only minimally reduce panel assembly costs, the proposed automated manufacturing will attack the highest/most labor intensive cost components of manufacturing a panel assembly, namely; CICing, glassing, stringing, panel laydown, and validation testing.   DSS's modular IMBA/SPM photovoltaic flexible blanket assembly coupled with automated manufacturing promises to provide ultra-affordable, high-performance, and repeatable high-quality photovoltaic panel assemblies for future NASA Space Science and Exploration missions, and particularly for ultra-high-power SEP missions.","NASA space applications are comprised of practically all Exploration, Space Science, Earth Science, Planetary Surface, and other missions that require high-efficiency photovoltaic power production through affordable solar arrays.  The technology is particularly suited for NASA's SEP missions and other missions that require game-changing performance in terms of extremely large deployed areas, affordability, ultra-lightweight, and compact stowage volume.  The technology is also well suited for applications requiring scalability/modularity, operability within high radiation environments, high voltage operation, and LILT/HIHT operation.  The proposed technology is estimated to ultimately reduce standard photovoltaic panel assembly costs by an astounding 49% for space applications.","Non-NASA space applications are comprised of practically all missions that require high-efficiency photovoltaic power production through affordable solar arrays.  The technology is particularly suited for SEP missions that require game-changing performance in terms of large deployed areas, affordability, ultra-lightweight, and compact stowage volume.  Applicable non-NASA space missions include: LEO surveillance, reconnaissance, communications and other critical payload/equipment satellites, LEO commercial mapping and critical payload/equipment satellites, MEO satellites & space-tugs, GEO commercial communications and critical payload/equipment satellites, and GEO communications and payload/equipment satellites.  The proposed technology also has tremendous dual-use non-space commercial private-sector applicability including fixed-ground and deployable/retractable mobile-ground based systems whereby such automation allows commercial affordability. The proposed technology is estimated to ultimately reduce standard photovoltaic panel assembly costs by an astounding 49% for space applications.","Actuators & Motors; Algorithms/Control Software & Systems (see also Autonomous Systems); Autonomous Control (see also Control & Monitoring); Circuits (including ICs; for specific applications, see e.g., Communications, Networking & Signal Transport; Control & Monitoring, Sensors); Conversion; Data Acquisition (see also Sensors); Generation; In Situ Manufacturing; Manufacturing Methods; Materials (Insulator, Semiconductor, Substrate); Models & Simulations (see also Testing & Evaluation); Operating Systems; Perception/Vision; Polymers; Pressure & Vacuum Systems; Process Monitoring & Control; Processing Methods; Project Management; Prototyping; Robotics (see also Control & Monitoring; Sensors); Software Tools (Analysis, Design); Sources (Renewable, Nonrenewable); Thermal Imaging (see also Testing & Evaluation)"
12-2 H8.04-9949,NNX13CC49P,Advanced Photovoltaic Systems,Low Cost Automated Manufacture of PV Array Technology (P-NASA12-007-1),"Vanguard Space Technologies, Inc.","9431 Dowdy Drive, San Diego, CA 92126 - 4336",(858) 587-4210,Nicholas Walmsley,nwalmsley@vst-inc.com,"9431 Dowdy Drive, San Diego, CA 92126 - 4336",(858) 587-4210  Extension :1849,Steven L Sherman,smonroe@vst-inc.com,"9431 Dowdy Drive, San Diego, CA 92126 - 4336",(858) 587-4210  Extension :1826,4,5,"Spacecraft for NASA, DoD and commercial missions need higher power than ever before, with lower mass, compact stowage, and lower cost. While high efficiency, space-qualified solar cells are in themselves costly, integrating them into a high performance Photovoltaic Assembly (PVA) using conventional glassing, interconnecting, stringing, tiling and laydown techniques can double their cost in $/Watt. The cost of solar power could be significantly reduced if the design of the Photovoltaic Assembly could be modified, modularized and standardized to be compatible with automated electronic assembly and terrestrial solar panel manufacturing methods. Additional benefits of such an approach include higher quality and consistency, improved qualification traceability, and robustness on thin flexible as well as rigid arrays. During the Phase I effort Vanguard successfully demonstrated automated pick-and-place, electrical interconnection, and adhesive dispensing adapted to our lightweight flexible Thin Integrated Solar (THINS) PVA. THINS uses multi-cell covers and advanced interconnection and encapsulation technology, which enables automated integration of traditional and advanced space qualified solar cells. Engineering economic analysis showed the potential for >30% PVA $/Watt cost reduction, while the encapsulation approach associated with THINS showed enhanced durability in space environments, even at high voltages and extreme thermal cycle environments. During the Phase II Program we will further enhance our automated sub-module manufacturing, and scale the approach to the module level. Automated assembly scale up will be performed while integrating into an existing deployable space structure platform, enhancing the TRL of a high performance high power application of automated cell integration scalable from tens to hundreds of kilowatts, and providing a credible commercialization path, all while reducing solar array costs by more than $150/W.","Low cost, lightweight, high power solar arrays with compact packaging and high voltage capability is an enabling technology for meeting the key NASA objective of implementing solar electric propulsion, which enables enhanced planetary, human exploration, and orbit transfer missions. With these missions projecting prime power growth to 25 - 300kW, the automated assembly of THINS arrays with today's space qualified triple junction cells meets these needs with improved specific power by a factor of >3X, an improved volumetric efficiency when stowed for launch by a factor of >8X, and a PVA cost reduction of >30% compared to today's solar arrays.  The approach additionally prepares for the low cost integration of IMM solar cells as they become qualified. These improvements, together with demonstrated high operating voltage capability exceeding 300V, allow an affordable high power system up to hundreds of kW to be packaged into a single launch. The THINS Array also has the advantages of improved high voltage stability and electromagnetic cleanliness because of surface continuity available from encapsulation, with similar technology developed at Vanguard already transitioned through a NASA Phase III SBIR to the Magnetospheric MultiScale (MMS) mission.","The trend towards Solar Electric Propulsion to supplant chemical propulsion for orbit-raising and station-keeping, and the advent of ""all-electric"" spacecraft which use SEP for orbital transfer and stationkeeping, have driven the need for both higher power and higher voltage in commercial and DoD spacecraft. Commercial spacecraft have trended toward higher power to also provide more capability (e.g. more bandwidth or coverage) which translates directly to increased revenue for the spacecraft operator. Additional functionality for military spacecraft, including enhanced communication, reconnaissance, and on-orbit computational capabilities, as well as the maneuverability afforded by SEP also drive to higher power requirements. The implementation of a low mass, low volume, low cost array with improved cost and environmental robustness benefits all of these applications.",Conversion; Generation; Processing Methods
12-2 H9.01-9372,NNX13CP12P,Long Range Optical Communications,Isolation Platform for Long Range Optical Communications,"Controlled Dynamics, Inc.","18141 Beach Blvd, Suite 170, Huntington Beach, CA 92648 - 8602",(562) 732-4694,Scott Green,sgreen@controlled-dynamics.com,"18141 Beach Blvd, Suite 170, Huntington Beach, CA 92648 - 8602",(562) 735-3065,Scott Green,sgreen@controlled-dynamics.com,"18141 Beach Blvd, Suite 170, Huntington Beach, CA 92648 - 8602",(562) 735-3065,4,6,"Optical communication links provide higher data transfer rates with lower mass, power, and volume than conventional radio-frequency links. For deep space applications at long operational ranges, high performance stabilization of the space terminal data link is required. To meet this need, CDI has developed a novel application of our free-floating isolation platform. Based upon a Shuttle-proven technology, this approach yields 6-DOF isolation from the disturbances of the host vehicle while providing high-bandwidth active stabilization to attenuate both payload disturbances as well as any residual disturbances transferred from the base across the power/data umbilical. The proposed approach is designed to achieve better than 0.5microradian-rms stabilization for all frequencies above 0.1Hz when operating on a spacecraft.Phase I developed the design concept, demonstrated robustness through sensitivity studies, demonstrated performance through simulation, and establish the feasibility of the approach to meet the space terminal isolation requirements. Component testing of the sensors and actuators further demonstrated that the design will meet the performance requirements. These tests and analyses advanced the technology to TRL-4.Phase II continues the development by ground testing an end-to-end prototype on a soft suspension testbed to demonstrate overall performance in a simulated low-g operational environment. Both acquisition search and beacon track will be demonstrated. Iterations of development and environment testing are performed to produce several space qualified 2-axis strut assemblies for delivery to NASA. Three strut assemblies rigidly mounted to any space terminal will provide 6-DOF isolation and high-bandwidth stabilization. These struts are designed for robustness so they can be used as an add-on to any rigid structure, thus enabling a broad range of space applications that require high-precision stabilization, isolation, and pointing.","The isolation and stabilization technology developed through this research is targeted for insertion into NASA's deep space planetary missions demonstrating long range optical communications. The capability is considered a ""Push Technology"" enabling new missions or enhancing missions already planned for the Integrated Radio and Optical Communications (iROC) program, the Space Communications and Navigation (SCaN) program, and the Deep Space Optical Terminal (DOT) project.","By providing component-level isolation and stabilization at the optical payload, this approach does not impose any unusual constraints on the host vehicle. This makes the technology broadly applicable to a wide range of vehicles including sRLVs, orbital RLVs, Earth orbiting satellites (even the simplest thruster-only designs), and deep space vehicles. The technology is targeted for high data throughput applications requiring optical links, but the core approach is applicable any space payload requiring high-performance isolation and stabilization. Applications include commercial and military communications satellites, next-generation large space telescopes, space-based interferometric telescopes, advanced geo-pointing surveillance and reconnaissance payloads, etc.  NASA and the U.S. comprise less than half of the overall total satellite market, so there are significant international applications for the technology.","Antennas; Inertial (see also Sensors); Lasers (Communication); Relative Navigation (Interception, Docking, Formation Flying; see also Control & Monitoring; Planetary Navigation, Tracking, & Telemetry); Telemetry (see also Control & Monitoring); Telemetry/Tracking (Cooperative/Noncooperative; see also Planetary Navigation, Tracking, & Telemetry); Teleoperation; Transmitters/Receivers"
