Proposal Number,Phase 1 Contract #,Subtopic Title,Proposal Title,Small Business Concern_Firm,Small Business Concern_Address,Small Business Concern_Phone,Principal Investigator_Name,Principal Investigator_E-mail,Principal Investigator_Address,Principal Investigator_Phone,Business Official_Name,Business Official_E-mail,Business Official_Address,Business Official_Phone,TRL_Begin,TRL_End,Technical Abstract,Potential NASA applications,Potential non-NASA applications
02-2 A7.01-9281 (For NASA Use Only - Chron: 022718 ),NAS1-03024,Modeling and Control of Complex Flows Over Aerospace Vehicles and Propulsion Systems,Next Generation Data Management of Large-Scale CFD Simulations,"JMSI, Inc. dba Intelligent Light","1290 Wall Steet West Third Floor, Lyndhurst , NJ   07071 - 3603",(201 ) 460  - 4700,David Edwards,dee@ilight.com,"1290 Wall Steet West Third Floor, Lyndhurst , NJ   07071 - 3594",(201 ) 460  - 4700,,,,,,,"Large-scale, 3D simulations of complex configurations using Computational Fluid Dynamics (CFD) have become increasingly critical in the design of aircraft, aerospace vehicles and propulsion systems. The CFD analysis process consists of three phases: pre-processing, solver and post-processing. Multi-disciplinary techniques, which analyze phenomena such as fluid-structure interaction, introduce additional computational complexity and require non-trivial coupling between CFD and structures codes. In designing software for each of the three analytical phases, software developers tend to look at what is optimal and necessary for their particular operation. Considerations such as data sharing, archiving and interoperability are given less attention than efficiency and accuracy of physical models. As the pace of simulation increases, the sheer volume of numerical data requires that a stable and easy to operate methodology be made available to developers and users of pre-processing, post-processing and solver tools. The offeror proposes to create a software toolkit that provides an intelligent storage and retrieval mechanism for large-scale CFD simulation data, combining software libraries, database/compression methodologies and web browser-style control and query tools. This toolkit will assist those developing and maintaining solver codes as well as the analyst/designer community and greatly accelerate aerospace vehicle synthesis by enabling data sharing, storage efficiency and interoperability.","NASA programs such as ASCoT, AVST and 3rd Generation RLV all have components that hope to develop new, fast tools for rapid assessment of new vehicle configurations. FAAST is one such element. The technologies proposed herein can be used by authors of these solvers and pre/post-processing tools to accelerate their development of tools. Designers and analysts can then take advantage of the benefits of the technologies in their work as well. Current NASA CFD tools that are known to the offeror are CFL3D, OVERFLOW, TLNS3D, VULCAN and USM3D.","Integration of the proposed technologies into CFD analysis codes will increase productivity and interoperability between industrial users of CFD in the Aerospace, Automotive, Propulsion and Chemical Process industries. The technologies are applicable to commercial CFD codes, those developed by the government and in-house codes as well. The technology can be extended to other forms of analysis, such as structural analysis, heat transfer and computational electromagnetics (CE). Furthermore, it can be used to assist in coupling such codes for multi-disciplinary analysis."
02-2 A7.02-7501 (For NASA Use Only - Chron: 024498 ),NAS4-03006,Modeling and Simulation of Aerospace Vehicles in a Flight Test Environment,Finite Element based Fracture Mechanics using Multidisciplinary Approach,MATRA,"P.O. Box 1264, Carmel , CA   93921 - 1264",(831 ) 917  - 0943,Dr. Shun Lung,kolar@redshift.com,"P.O. Box 1264, Carmel , CA   93921 - 1264",(831 ) 917  - 0943,,,,,,,"Fracture mechanics capabilities based on finite element multidisciplinary analysis will be designed and developed. Incorporating finite element based fracture mechanics analysis will enhance the power and strength of the MDFEM software.  An in depth literature survey will be conducted to assess the appropriate finite element methodology for modeling crack tip stress regions and associated material constitutive relations. In order to characterize fracture behavior, crack tip finite elements, crack tip opening displacement and J-integral methods will be implemented. Software to perform these fracture related parameters will be developed and tested with benchmark problems.","The development of fracture mechanics capabilities enhances the strength and applicability of existing finite element multidisciplinary engineering analysis software such as  STARS software. Such capabilities enable application to monitor and perform risk assessment of flight vehicle structural integrity in NASA?s shuttle programs, Flight Testing of Research flight vehicles, extending flight envelope of test flight vehicles. The structural integrity and safety monitoring of NASA's shuttle programs, Flight Test Research vehicles, lauch vehicle structural integrity risk assessment will be potential beneficiaries.","The development of fracture mechanics capabilities enhances the strength and applicability to monitor and perform risk assessment of structural integrity in such areas as commercial airplane structures, nuclear power plants, and other fracture and damage critical structural components in rail-roads, off-shore structures, and automobiles. Other applications include home land security related issues with nuclear power plants, and other fracture and damage critical structural components of national security interests."
02-2 A7.03-9587 (For NASA Use Only - Chron: 022412 ),NAS4-03008,"Flight Sensors, Sensor Arrays and Airborne Instruments for Flight Research",Optical Sensor for Detection of Fatigue Damage Precursors,"MetroLaser, Inc.","2572 White Road, Irvine , CA   92614 - 6236",(949 ) 553  - 0688,Christina  Arnold,carnold@metrolaserinc.com,"2572 White Road, Irvine , CA   92614 - 6236",(949 ) 553  - 0688,,,,,,,"Investigation into fatigue damage precursors over the last decade has demonstrated that surface-evident defects such as cracks and slipbands evolve in a regular manner, which corresponds to the development of fatigue damage. Through examination of the evolution of such damage precursors in a component, this regularity can facilitate prediction of the component?s remaining fatigue life. The proposed Phase 2 work is to develop and characterize a sensor for in-situ examination and historical tracking of the precursor defects and to construct the analytical framework for using that data to predict the onset of catastrophic failure. Since a major application of this technology is for monitoring fatigue damage in aircraft components, the proposed system will be compact, durable, and relatively inexpensive. The Phase I results have confirmed models of precursor evolution on surfaces; and testing of several prototype surface inspection devices has shown that the technology is compatible with the restrictions on light sources, beam scanners, detection systems, and communication interfaces which this application demands. Design analysis and preliminary designs have also been completed for the in-situ sensor modules as well as their supporting communications and control systems, so that this technology is now ready to enter Phase II development.","NASA requires advanced sensors to inspect critical components of airframes that are subjected to low and high-cycle fatigue. If unchecked, fatigue-induced damage in airframe components can lead to formation of cracks. Crack formation is often followed by sudden catastrophic failure of the airframe component and destruction of the aerospace vehicle. By providing a timely warning, the proposed sensor will assist in identifying potentially damaged components, and in this way will improve safety of aerospace vehicles while reducing maintenance costs.","Since over 90% of mechanical failures are due to fatigue damage, the proposed sensor will be useful in many industries which employ dynamically loaded mechanical systems. Of particular significance are the commercial and military aircraft industries, where the instrument could be used to quickly verify the safety condition of many critical components, such as turbine blades, fuselage panels, and landing gear. In addition, many other industries can benefit from this diagnostic tool including the automotive, power generation, shipping and railroad industries.  Additionally, fatigue over spans of years is of interest in structural members in many construction and civil engineering contexts, and a mature form of this technology could become sufficiently inexpensive and long-lived to provide automatic fatigue monitoring capability in these as well.  The two most direct applications are (a) in detecting the onset of highly premature failure of components that would not be detected in ordinary scheduled inspections and (b) in providing a new type of window into the fatigue history of a component. In this latter function, the devices will provide a rich new source of data for the highly developed field of materials engineering dealing with prediction of remaining fatigue life, reliability, and durability."
02-2 A7.03-9648 (For NASA Use Only - Chron: 022351 ),NAS4-03009,"Flight Sensors, Sensor Arrays and Airborne Instruments for Flight Research",Real-time Aeroelastic Measurement System (RAMS) for in-Flight Flutter Testing,"Tao of Systems Integration, Inc.","471 McLaws Circle, Suite 1, Williamsburg , VA   23185 - 5525",(757 ) 220  - 5040,Elizabeth Compton,liz@taosystem.com,"471 McLaws Circle, Suite 1, Williamsburg , VA   23185 - 6317",(757 ) 220  - 5040,,,,,,,"A high dynamic response, Real-time Aeroelastic Measurement System (RAMS) using microns-thin hybrid sensor arrays will be developed to provide simultaneous unsteady normal-pressure and tangential shear-stress distributions on lifting surfaces undergoing bending and torsion during in-flight flutter testing. The surface signatures obtained with these sensors will be used to simultaneously obtain, in real-time, the spatial location and dynamic characteristics of unsteady flow phenomena such as boundary-layer transition, vortex flows, flow separation, and shock (flow oscillations) and boundary oscillations (flutter). Surface signatures will provide accurate information on the amplitude and frequency of the aerodynamic forcing functions, as well as the time lag between unsteady aerodynamic phenomena and the structural response of the test article. RAMS will provide flight-test researchers with an effective tool to obtain time-accurate unsteady coupling physics of the aerostructural system by sensing surface signatures coordinated with pressure, strains, and accelerations. With the proposed measurements there will be an entire force-response description of the aerostructural dynamics. RAMS will result in a comprehensive measurement technology that can be used for routine flutter flight-testing, CFD validation, development of new and advanced design tools, development of active aeroelastic wing (AAW), and the development of flutter warning and active control systems.","RAMS will be of value to ground / flight-testing and health monitoring of fixed-wing and rotary-wing aircraft, turbo-machinery, propellers, unmanned vehicles, missiles, and space vehicles. Advanced aerospace vehicles tend to be slim and elastic, resulting in severe aeroservoelastic problems at high speeds, which require attention in both design and routine performance for safety and ride quality. All vibrating structures subjected to unsteady aerodynamic or hydrodynamic forces and moments are prone to aeroelastic and flutter problems, which could lead to catastrophic results unless properly taken care of. RAMS will be of value to the design and testing of sails of sailboats, high-rise buildings, chimneys of power and cooling towers of plants, masts of ships, and other structures subjected to vibrations in the presence of fluid flow.","RAMS has significant potential applications for  the aerospace industry. Flutter is one of the chief limiting factors in the design of more efficient and more maneuverable high-speed aerospace vehicles. The proposed innovation will significantly contribute to the important recent initiative taken by NASA DFRC to develop Active Aeroelastic Wing (AAW). Aerodynamic nonlinear effects could be severe in the high transonic Mach numbers due to, for example, changes in the flow separation and shock wave patterns with amplitude of oscillation. Nonlinear effects are likely to become more important in the future as aircraft fly faster, are more flexible, and use complex control systems. The benefits of successfully addressing the flutter problem will lead to a larger safe-flight envelope and payload for aerospace vehicles, which can be translated to economic value, while simultaneously possessing superior maneuver performance."
02-2 A7.04-7529 (For NASA Use Only - Chron: 024470 ),NAS2-03117,Knowledge Engineering for Safe Systems in Lifecycle Engineering,Simulation and Analysis of Socio-Technical Risk using SpecTRM,Safeware Engineering Corporation,"1520 Eastlake Ave. E., Suite 101, Seattle , WA   98102 - 3717",(206 ) 328  - 4880,Grady Lee,lee@safeware-eng.com,"1520 Eastlake Ave. E., Suite 101, Seattle , WA   98102 - 3717",(206 ) 328  - 4880,,,,,,,"We propose to create model-based simulation and analysis tools for risk management throughout the system life cycle.  Rather than using traditional approaches based on failure events in static engineering designs, we will treat a system as a dynamic process that is continually adapting to achieve its ends and to react to changes in itself and its environment.  The original design must not only enforce appropriate constraints on behavior to ensure safe operation, but the system must continue to operate safely as changes occur.  The process leading up to an accident (loss event) can be described in terms of an adaptive feedback function that fails to maintain safety as performance changes over time to meet a complex set of goals and values.  Using this definition of risk management, we will extend our commercial system engineering tool set to include model-based simulation and analysis of risk throughout the system life cycle, including complex human decision-making, software errors, system accidents (versus component failure accidents), and organizational risk factors.",The results of this SBIR research will be potentially applicable to every NASA project where significant losses can result from the operation or lack of operation of the system.  It should be particularly important in systems with significant software and human automation interaction components and in large projects where management decisions about risk are critical and need to be supported.,"The results of this SBIR project will be applicable to risk management in any safety-critical system.  SpecTRM-RL, the modeling language as well as the more SpecTRM requirements specification and analysis tools, are currently in use in the automotive and aerospace industries and being evaluated for use in the medical device industry as well."
02-2 A7.04-9392 (For NASA Use Only - Chron: 022607 ),NAS2-03118,Knowledge Engineering for Safe Systems in Lifecycle Engineering,Networks in Organizational Risk Management,"Aptima, Inc.","12 Gill Street, Ste 1400, Woburn , MA   01801 - 1728",(781 ) 496  - 2424,Dr. Kari Chopra,kchopra@aptima.com,"12 Gill Street, Ste 1400, Woburn , MA   01801 - 1728",(215 ) 765  - 5942,,,,,,,"We propose to develop a formal modeling software tool, Networks in Organizational Risk Management (NORM), that allows mission planners and organizational designers to create and experiment with organizational structures that minimize risk throughout the lifecycle of a system. The core of our approach is a computational organizational model of the network of interrelationships among people, knowledge, tasks, technology, organizational goals, system failures, and the surrounding environment. In Phase I we defined a simulation and optimization model of organizational safety and illustrated the use of NORM as applied to Team X, a concurrent engineering design team specializing in unmanned space missions. In Phase II we will develop the NORM modeling software, develop a customized Team X application, and perform a comparative analysis of Team X using NORM and several additional computational modeling tools.","Formal modeling of organizational risk management is critical to a variety of NASA applications, including launch operations, the Mission to Mars, and the International Space Station (ISS). Failures such as the Challenger launch and the Mars rover illustrate the need for tools to design organizations that minimize rather than induce errors, and to identify latent errors introduced during design and construction before they manifest themselves as operational failures providing little opportunity for recovery. The challenges of constructing, maintaining, and continually expanding the ISS demand cost-effective methods for predicting the impact of new technologies on system safety prior to installation.","The capabilities of NORM are most likely to appeal to customers who have the need to analyze and improve organizational safety or design organizations for safe operations. Examples of potential applications include air traffic control, supervisory control systems, command and control systems, ground and maritime transportation, hospital administration, construction, and manufacturing. In addition, management consulting firms provide a potential market for software licensing and consulting services. Business analysts that advise corporate management on safety issues require a deep understanding of the risks present in the organization, but are typically unacquainted with scientific methods for rigorously modeling and analyzing organizational risks."
02-2 A8.01-9327 (For NASA Use Only - Chron: 022672 ),NAS1-03027,Revolutionary Aerospace Vehicle Systems Concepts,Commercial Framework for Bi-Level Integrated System Synthesis,Phoenix Integration,"1715 Pratt, Blacksburg , VA   24060 - 0000",(540 ) 961  - 7215,Brett Malone,malone@phoenix-int.com,"1715 Pratt, Blacksburg , VA   24060 - 0000",(540 ) 961  - 7215,,,,,,,"This Phase II proposal by Phoenix Integration is intended to refine and bring to market the NASA Bi-Level Integrated System Synthesis (BLISS) technology. BLISS is a method to address the above difficulty by defining engineering system optimization problems in terms of subsystems and disciplines that correspond to a natural structure of engineering team in specialty groups.  Making the BLISS method useful in industrial practice requires software that creates an environment where engineers and managers can freely interact and optimize performance and cost. Phoenix proposes innovative software to bring BLISS to industry by using Web-based integration of users in a Multidisciplinary environment combined with the automation of computer assets. The automation will provide seamless parallel computing in a distributed manner prescribed by the BLISS methodology.  In the Phase I research we defined the key system requirements, performed a design optimization test case to confirm these requirements, and completed a preliminary design for the Phase II system development.  Phase II development will include eight technical tasks covering a twenty-one month time frame. The program has been structured so that the development efforts will result in a working system after the first year with the balance of required features being incorporated during the remaining nine months","The proposed software will help NASA streamline program management by combining collaborative project tools with system design and analysis. Phoenix software will help integrate program management with engineering to give a total picture for optimizing the mix of performance against cost and risk. NASA will realize a significant reduction in workflow problems due to non-concurrent data and information that is not synchronized with program schedules and goals. Furthermore, the proposed innovation will allow NASA program managers to view complex system interactions. For NASA it will enhance the Advanced Engineering Environment (AEE) and find immediate application on current projects such as Next Generation Launch Technology, Orbital Space Plane, Engineering for Complex Systems, and Aeronautics.","The software can be applied to a wide spectrum of defense, electronic, and automotive industries.  Benefits will derive from significantly reducing the cost of weapons system design, making industrial products more robust, and enabling companies to use their engineering resources more efficiently.  These benefits are all based on the Phoenix Integration implementation of BLISS that will allow the combining of diverse and distributed engineering organization skills, make feasible the optimization of the design process. This evolutionary approach to development, testing, and market introduction will facilitate program management, minimize project risk, and accelerate market penetration.   The business plan details an approach to achieve sales of $13M within five years. Phoenix has partnered with The Boeing Company as a commercialization pathfinder. Boeing intends to use versions of the BLISS software on reusable launch vehicles, hypersonics, the 7E7 commercial transport, and the Army?s Future Combat System. These are all representative programs for industry."
02-2 A8.02-7852 (For NASA Use Only - Chron: 024147 ),NAS4-03010,Revolutionary Flight Concepts,UV Rigid Inflatable Wing,"Adherent Technologies, Inc.","9621 Camino del Sol NE, Albuquerque , NM   87111 - 1522",(505 ) 346  - 1685,Ronald E. Allred,adherenttech@comcast.net,"9621 Camino del Sol NE, Albuquerque , NM   87111 - 1522",(505 ) 346  - 1685,,,,,,,"As the unmanned exploration of Mars and Venus becomes more of a focus area at NASA, inflatable, rigidizable wings will become an enabling technology.  The successful development of this type of wing will also have significant military applications in unmanned aerial vehicles (UAVs).  Rigidization of inflatable wings provides several potential advantages, including reducing the vulnerability to punctures, increasing stiffness and load-carrying capability, allowing a higher aspect ratio for high altitude efficiency and longer missions, and reducing weight by eliminating the make up pressurization supply.  In the Phase I program, rapid cure resin systems (10 sec at 0?aC) with long shelf lives (>10 yrs) were formulated and used to fabricate, deploy, and rigidize a half span wing.  Mechanical tests of the rigidized wing showed that it had attained the desired stiffness.  The Phase II program will demonstrate internal cure, tailoring the resin formulation and lighting system for more efficient rapid cure at low temperatures, determine a more optimized design for a selected application, and demonstrate improved manufacturing techniques with skinning for better aerodynamic performance.  Wind tunnel tests of the optimized wing will be conducted including deployment and rigidization with internal light cure.  Aerodynamic behavior during deployment and rigidization and of the rigidized wing will be determined.","The proposed work will result in a new materials technology for rigidizable inflatable aero-structures.  It is expected that the ROC technology will be adopted by the inflatables community for use by NASA and its contractors for a variety of space missions involving large antennas, mirrors, radars, and Gossamer structures such as solar sails.  Rigidization of inflatable wings provides several potential advantages for planetary exploration, including reducing the vulnerability to punctures, increasing stiffness and load carrying capability, allowing a higher aspect ratio for high altitude efficiency and longer missions, and reducing weight by eliminating the make up pressurization supply.","The eventual markets for inflatable spacecraft are extremely large for communications antennas and radars.  In the commercial sector, over 200 satellites are expected to be launched in the next 10 years to meet consumer demand for cellular phones and other communication devices.  A large number of military satellites are also expected to be launched in that timeframe.  Military UAVs represent another potentially large market for UV rigidized inflatable aero-structures for munitions and survilance missions.  Inflatable shelters for military and emergency uses and field appliable splints represent additional markets as do rapid cure coatings and adhesives.  The unique features of the ROC?? technology bring a distinct competitive advantage to the marketplace for inflatables compared to competing technologies."
