Proposal Number,Phase 1 Contract #,Subtopic Title,Proposal Title,Small Business Concern_Firm,Small Business Concern_Address,Small Business Concern_Phone,Principal Investigator_Name,Principal Investigator_E-mail,Principal Investigator_Address,Principal Investigator_Phone,Business Official_Name,Business Official_E-mail,Business Official_Address,Business Official_Phone,TRL_Begin,TRL_End,Technical Abstract,Potential NASA applications,Potential non-NASA applications
02-2 A1.01-8269 (For NASA Use Only - Chron: 023730 ),NAS1-03012,Flight Deck Situation Awareness and Crew Systems Technologies,Constraint-based Analysis of Aircraft Operations,Charles River Analytics Inc.,"625 Mount Auburn Street, Cambridge , MA   02138 - 4555",(617 ) 491  - 3474,Greg Zacharias,glz@cra.com,"625 Mount Auburn Street, Cambridge , MA   02138 - 4555",(617 ) 491  - 3474,,,,,,,"The analysis of flight data presents us with the opportunity of sophisticated insights into the functioning of aircraft systems and into the effects of aircraft operations. However, the complexity and size of the data acquired through flight data logging represent a challenge to the most complex tools to date. The effort proposed herein sets forth a multi-phase approach for the efficient application of existing data processing, visualization and analysis techniques for the identification and characterization of safety-relevant flight conditions, and for the identification of their precursors. The approach starts by reducing the voluminous flight data into a feature-based encoding, where features used for each flight parameter type are selected to match its specific variation. The second processing phase allows domain experts to efficiently inspect the flight data starting from detected exceedances, and to formulate constraint-based hypotheses regarding co-occurring events, and possible precursors. The third phase uses the hypotheses developed during the second phase to apply constraint-based data mining techniques for the identification of patterns associated with exceedances, and to identify the precursor sets for safety-relevant flight conditions. The description of the proposed effort also includes preliminary implementation results for selected prototype components, and establishes the feasibility of the investigated approach.","We expect the full-scope environment for Constraint-based Analysis of Aircraft Operations to have immediate and tangible benefit for the Aviation Performance Measurement System. The proposed capability provides an approach to analyzing the vast amount of data collected during routine flights, to detect and characterize behaviors that are transient, and may potentially remain undetected, and to identify their precursors. The proposed approach will offer domain experts immediate access to the important flight data analysis capabilities, and will be applicable to a variety of safety analysis problems and aircraft types. The proposed effort has also integration potential with components of the Aviation Safety Program at NASA?s Langley Research Center, and has application potential to the analysis of engine condition data for the Space Shuttle Main Engines.","The non-NASA commercial applications of the technology for Constraint-based Analysis of Aircraft Operations will pursue the licensing of our constraint-based behavior verification technology to system integrators in the intelligent agent industry, and the application of the proposed approach to maintenance operations conducted by major airlines. Recent commercial scale experiments have demonstrated that the identification and recognition of safety-relevant flight and engine conditions can help airlines significantly optimize their maintenance schedule. The proposed approach would represent a new step in that direction, by helping maintenance personnel to accurately define the context in which certain engine conditions occur, and to take appropriate measures."
02-2 A1.02-7454 (For NASA Use Only - Chron: 024545 ),NAS3-03026,Propulsion and Airframe Failure Data and Accident Mitigation,Design and Manufacture of Lightweight Composite Fan Case,WebCore Technologies Corp.,"591 Congress Park Dr., Dayton , OH   45459 - 0000",(937 ) 297  - 4200,Michael Sheppard,msheppard@webcoreonline.com,"591 Congress Park Dr., Dayton , OH   45459 - 0000",(937 ) 297  - 4200,,,,,,,"The goal of this program is to mature the FRF sandwich panel design for the engine fan case application.  Toward this goal, the following technical objectives will be pursued.  This program will demonstrate how critical structural details are incorporated with TYCOR technology, leading to unitized structures that require less post-processing than composite laminate approaches.  The work will be focused on a commercial jet engine application using WebCore?s relationship with aircraft engine manufacturers to identify the best application.Structural and physical properties will be verified in each component structure as well as the final, integrated fan case.  The manufacturing processes used in the production of the engine case will be evaluated and refined. These include technologies to aid in the production of preforms, the methods for processing and molding the bodies of revolution.  Of particular importance will be the molding of full-circumferential bodies and the production and molding of non-uniform cross-sections.  Using the data collected during this program, a cost model will be generated to document the cost advantages of TYCOR/Resin Infusion Process technology vs. current baseline composite and metallic components.  Finally, a full-scale demonstration article will be produced in which the components are integrated into the design.  This fan case will show a full body of revolution with integral hard points and flange attachments.","This technology is pervasive and can be used for aerospace, marine, industrial, and transportation applications for ligtweight and durable composite structures.",This technology can be used for general aviation aircraft engines.
02-2 A1.02-8080 (For NASA Use Only - Chron: 023919 ),NAS3-03014,Propulsion and Airframe Failure Data and Accident Mitigation,"Development of a rugged, fuel tank compatible, oxygen concentration sensor","Advanced Projects Research, Inc.","1925 McKinley Avenue, Suite B, La Verne , CA   91750 - 5800",(909 ) 392  - 3151,Thomas Sobota,thsobota@advancedprojects.com,"1925 McKinley Avenue, Suite B, La Verne , CA   91750 - 5800",(909 ) 392  - 3155,,,,,,,"The objective of the proposed Phase II effort is to transfer proven sensor technology from the laboratory breadboard to a functional flight-ready prototype for installation in an aircraft fuel tank. In the Phase I effort, a novel spectroscopic technique was shown to be an effective method for measuring oxygen concentration in harsh environments with sufficient accuracy for use in an OBIGGS system. This system utilizes rapidly scanned Vertical Cavity Surface Emitting Diode Lasers (VCSELs) to measure oxygen concentration by molecular absorption. This system can measure 1000 ppm to 100% oxygen in ambient temperatures from -60 to 150 F utilizing as the wavelength agile spectral-harmonic (WASH) technique. The wavelength agile aspect of the laser source/detection technique allows for temperature insensitive measurements of oxygen concentration over a wide range of pressures (0.3 atm to 2 atm) with high accuracy as well as with auto-calibration capabilities. The Phase II effort is focused on packaging this sensor technology in a form that is able to be inserted into an operational aircraft fuel tank and conform to a set of environmental and operational requirements as defined by both the OBIGGS needs as well as the fuel tank environment. Furthermore, achievement of the Phase II goal requires the miniaturization of the laser driver, data collection, and data processing functions into flight-scale electronic hardware.","There are many commercial and military applications for an accurate and rugged fuel tank oxygen concentration sensor. The fuel tank oxygen sensor could be used in both new and retrofit commercial aircraft as a control sensor for fuel tank protection systems. The reliable and precise instrument can be used to control onboard inert gas generation systems (OBIGGS) for cargo compartment fire suppression, fuel tank inerting, and emergency breathing oxygen systems (OBOGS) for passengers and crew. The key to the commercial viability of this product is the accuracy of the sensor, its ability to handle harsh environments including highly variable temperatures and pressures, and its reliability and lifetime, which we have engineered into the system. The long operating lifetime and stability of this measurement system in challenging operating environments are superior to existing oxygen measurement strategies.",This type of sensor can also be used to monitor the air/fuel ratio in terrestrial gas turbine and high pressure combustion systems where a rugged sensor with long operating life characteristics is needed. Also possible using this sensor is a real-time measurement of oxygen tension in respiratory gases and respiration monitoring. The absorption based technique has no biofouling effects and is nearly independent of scattering environments such as heavy droplet sprays or moisture making the sensor useful in biological measurements.
02-2 A1.03-7779 (For NASA Use Only - Chron: 024220 ),NAS4-03002,Automated On-Line Health Management and Data Analysis,Embedded Dual-Function Arc Fault Circuit Breaker/ Locator based on OSA,"Williams-Pyro, Inc. (WPI)","2721 White Settlement Road, Fort Worth , TX   76107 - 1331",(817 ) 335  - 1147,Matthew Scarpino,matt.scarpino@williams-pyro.com,"200 Greenleaf, Fort Worth , TX   76107 - 1471",(817 ) 872  - 1500,,,,,,,"Within Phase 2, Williams-Pyro has designed, developed, and demonstrated a system for locating arc faults along aircraft cable.  This fault localization is performed using signal reflectometry, in which an electrical waveform is transmitted through a length of wire.  After the reflection is received, the characteristics of the reflected signal will be used to determine how far away the arc fault is located.  After miniaturizing this system, it will be possible to integrate this functionality within a Texas Instruments' arc fault circuit breaker.  In this manner, TI's AFCB's will be able to tell maintenance personnel where to look in order to perform repairs on the aircraft cable","This system will be able to reduce the maintenance time and effort involved in repairing faulty electrical cable on NASA aircraft.  After an arc fault has occurred, the Smart Wiring Infrastructure Fault Tester (SWIFT) will activate, using signal reflectometry to determine where the arc fault is located.  Then, the SWIFT-enabled arc fault circuit breaker (AFCB) will be able to display the fault's location to the maintainer, saving hours of hunting for the damage within the wire.  Texas Instruments has agreed that, given effective operation of the SWIFT functionality, they will be willing to consider integrating a SWIFT application specific integrated circuit (ASIC) within their Klixon family of aircraft circuit breakers","This system will be able to reduce the maintenance time and effort involved in repairing faulty electrical cable on commercial aircraft.  Following an arc fault, the Smart Wiring Infrastructure Fault Tester (SWIFT) will activate, using signal reflectometry to determine where the arc fault is located.  Then, the SWIFT-enabled arc fault circuit breaker (AFCB) will be able to display the fault's location to the maintainer, saving hours of hunting for the damage within the wire.  Texas Instruments has agreed that, given effective operation of the SWIFT functionality, they will be willing to consider integrating a SWIFT application specific integrated circuit (ASIC) within their Klixon family of aircraft circuit breakers"
02-2 A2.01-9022 (For NASA Use Only - Chron: 022977 ),NAS3-03035,Propulsion System Emissions and Noise Prediction and Reduction,High Temperature Polyimides for Resin Transfer Molding Process,"Triton Systems, Inc.","200 Turnpike Road, Chelmsford , MA   01824 - 4000",(978 ) 250  - 4200,Mr. Norman Rice,nrice@tritonsystems.com,"200 Turnpike Road, Chelmsford , MA   01824 - 4053",(978 ) 250  - 4200,,,,,,,"We propose to develop a novel high temperature PMR-RTM polyimide resin with a low melt viscosity (<5 Poise at 288 ?C) that will address the NASA-GRC need for advanced materials for lightweight propulsion systems for reduced emissions.  Triton?s proposed innovative research will focus on developing a novel PMR-RTM polyimide resin that has a very low melt viscosity (1-5 Poise), excellent thermal stability and mechanical performance comparable to PMR-15.  This resin will allow out of autoclave manufacture of complex shaped parts, and the size of the part will not be limited by the size of the autoclave","Development of new low melt flow viscosity (RTM/VARTM), environmentally friendly high temperature polyimide resins would allow ?out-of-autoclave? manufacturing of large structures such as large composite tanks for the next generation Reusable Launch Vehicles (RLVs).  Currently the size of the autoclave predicts the size of the components that can be fabricated, which is a limitation for development of the next RLVs","Triton has teamed with end users to evaluate the development of the new RTM/VARTM high temperature resins for compatibility with their current composite manufacturing.  This teaming arrangement will assist Triton to develop the resin within the manufacturer production specifications.  The potential commercial applications are aircraft jet engines, rocket and turbine engines, and auxiliary power in aircraft and space vehicles."
02-2 A2.02-9354 (For NASA Use Only - Chron: 022645 ),NAS3-03025,Electric and Intelligent Propulsion Technologies for Environmentally Harmonious Aircraft,Co-Generation of High Purity Hydrogen and Electric Power,"Ceramatec, Inc.","2425 South 900 West, Salt Lake City , UT   84119 - 1517",(801 ) 978  - 2119,Patricia Vaughn,patricia@ceramatec.com,"2425 South 900 West, Salt Lake City , UT   84119 - 1517",(801 ) 978  - 2119,,,,,,,"The proposed innovation is an integrated hybrid solid state electrochemical system providing co-generation of high purity hydrogen and electric power. The embodiment is a physical, chemical and thermal integration of three processes: (1) production high purity hydrogen, (2) electrochemical partial oxidation of hydrocarbon fuel, and (3) power generation by a solid oxide fuel cell. This highly integrated, multi-function system eliminates any need for the CO shift and cleanup process steps currently required to generate hydrogen for use in Proton Exchange Membrane fuel cell power plants being considered for aircraft electric propulsion and power needs. It also eliminates the efficiency penalty imposed by use of conventional partial oxidation reformers. Thermal integration of the endothermic hydrogen generation processes with the exothermic SOFC operation achieves several benefits, notably higher efficiency by chemical recuperation and much lower air pre-heater duty (size, weight and cost) by eliminating the need for excess cooling air. The process facilitates sequestration of fuel carbon content by segregation of product CO2 from non-condensable gases. This innovation closes a significant void in the technology required to implement efficient, quiet and clean electric aircraft propulsion and power systems.",The proposed innovation would find application in meeting NASA needs related to: ? Fuel processing for electric aircraft propulsion and auxiliary power systems ? Ground based hydrogen production with CO2 sequestration,The proposed innovation would be generally applicable to the following non-NASA commercial applications: ? Aircraft and automotive auxiliary power ? Highway truck hotel power ? Fuel processing for automotive fuel cell electric vehicles ? Point of use hydrogen generation ? Stationary electric power generating plants
02-2 A2.03-8862 (For NASA Use Only - Chron: 023137 ),NAS3-03021,Revolutionary Technologies and Components for Propulsion Systems,Novel Titanium-based Lattice Block Structures,"Titech International, Inc.","4000 West Valley Boulevard, Pomona , CA   91769 - 3060",(909 ) 595  - 7455,Edward Chen,ti_castings@msn.com,"4000 West Valley Boulevard, Pomona , CA   91769 - 3060",(909 ) 595  - 7455,,,,,,,"Lattice block structures are innovative periodic cellular materials that derive their outstanding mechanical performance from a structure of highly ordered internal triangles, rather than the properties of the parent material.  They are innovations that can provide tremendous opportunities for weight and cost reduction in future aerospace and non-aerospace systems.  To date, lattice block structures have been successfully fabricated for a number of ferrous and non-ferrous metals, but not extremely difficult to cast reactive metals such as titanium-based alloys.  As titanium is one of the most important metallic materials in existence today, with growing importance in aerospace systems due to its superior strength-to-density, high temperature strength, and corrosion resistance, titanium alloy lattice block structures offer significant benefits to NASA and the industry if they can be successfully produced.  Consequently, the purpose of this SBIR Phase II effort is to demonstrate the feasibility of casting full scale lattice block structures from titanium alloys using a proprietary investment casting process.  A successful Phase II project paves the way to manufacturing actual lattice block structural components in Phase III and beyond, providing the necessary foundation for a more widespread acceptance of this unique technology in the industry.","Titanium-based alloys, including gamma titanium aluminides, are high temperature materials that can meet the ever-increasing demands for more robust, higher temperature-tolerant, and lighter weight hypersonic vehicle airframe components for commercial and military systems.  Titanium and gamma lattice block materials can be used as low weight structures within these applications.  For example, gamma lattice block structures could be considered for sandwich structures for thermal protection system for the reusable launch vehicle.  Other potential NASA commercial applications include aircraft engine components such as fan blade and compressor casings, nozzle flaps, and engine tiles for next generation aircraft gas turbines.","Essentially, any application and/or industry that need superior strength-to-density within relative affordability while retaining the physical properties of titanium and gamma alloys could use lattice block structures.  Furthermore, those that require potential replacements for Ni-based superalloys at lower temperatures and for titanium alloys at higher temperatures could consider gamma alloys.  Potential commercial applications include aero engine components, automotive engine components, and aircraft and spacecraft structural applications.  Other possible uses of lattice block materials include components for furniture, shipboard structures, building structures, automotive vehicle frames, and a potentially limitless number of other possibilities."
02-2 A2.04-8134 (For NASA Use Only - Chron: 023865 ),NAS1-03014,Airframe Systems Noise Prediction and Reduction,Improving Binaural Simulation of Structural Acoustics,"AUSIM, Incorporated","241 Polaris Avenue, Mountain View , CA   94043 - 4514",(650 ) 322  - 8746,Joel Storckman,jstorckman@ausim3d.com,"241 Polaris Avenue, Mountain View , CA   94043 - 4514",(650 ) 322  - 8746,,,,,,,"Phase I showed that the Singular Value Decompostion (SVD) technique significantly reduces processing requirements for 3D binaural rendering using Head Related Transfer Function (HRTF) datasets.  Equally important, the Equivalent Source Reduction (ESR) experiments completed show a dramatic simplification of the problem of acoustically modeling surfaces, with little to no perceivable difference in the auralization.While AuSIM3D? real-time binaural rendering capacity has grown from a few point sound sources four years ago to a few dozen point sources presently, largely due to gains in commodity processor speed, the performance improvement capacity shown by SVD and the simplification of the acoustic surface modeling problem demonstrated possible with ESR has been much more dramatic.  Our results show hundreds of point sources can now be realistically rendered in real-time, and that these sources can represent a relatively large surface with negligible loss of accuracy.  When these techniques are integrated in the AuSIM3D client and server applications as proposed in Phase II, it will be possible for the first time to binaurally render the sound of an acoustic disturbance applied to a surface model of considerable area. AuSIM is also eager to optimize the ESR and SVD implementations into commercial-quality software applications to create the next generation of AuSIM3D technology.  With the newly added horsepower, AuSIM3D applications will be soon able to render directly the acoustic data generated by industry standard Finite Element Analysis (FEA) acoustics vendors such as MSC/Nastran, COMET Acoustics, and ABAQUS.  These firms have already signed Letters of Intent to provide whatever technical support, collaboration, and marketing resources we need to become fully interoperable with their systems.  Soon designers will be able to regularly hear the acoustic performance of the surfaces they've designed while the models are still on the electronic drawing board.","AuSIM's end product will import acoustic data from major commercial FEA packages, allowing NASA to use computer models of aerospace surfaces for airplanes, rotorcraft, and space vehicles.  NASA applications that have a need to perceive the acoustic characteristics of aerospace surfaces range from assisting the design phase and the design promotion phase to, in the worst-case-scenario, assisting in the accident analysis phase.In the design and redesign of new and existing aerospace vehicles, it will be very useful to hear the effect of airflow on external surfaces.  Although noise levels alone can be quantified fairly well with existing technology, the spectral coloration that gives each sound its distinct characteristics can also determine how pleasant or unpleasant the sound will be to listeners.  The acoustic comfort level of the crew and passengers inside the craft is an important design factor, as it will affect the flight crew's level of fatigue, which will affect their ability to operate the craft safely.Another factor of concern to NASA engineers is the sound generated by an aircraft or spacecraft that reaches the ears of people on the ground.  Our end product will enable a design to be simulated under a range of normal operating conditions, and enable the completion of a perceptual study that will help determine which designs will have the minimum negative psychological impact on passengers, ground crew, and the general public.","The largest commercial applications of the technology would be in the aircraft and automobile industries, where millions of dollars are spent yearly to get new vehicles to operate with a more comfortable noise level. The real-time acoustic data rendering capabilities that would be enabled with the development of the SVD/ESR-enhanced 3D audio binaural simulation software could be applied widely throughout the automobile design world by licensing it to be integrated with existing and broadly used industrial acoustics analysis packages. Such a combined package would offer significantly more display versatility to engineers designing to optimize acoustic performance than any other package available today.  Existing FEA packages with acoustics analysis modules do well at quantifying the noise levels and spectral characteristics of vehicle surfaces in the presence of an acoustic disturbance, but determining which frequency distributions plotted on a view graph will produce a negative visceral human response, versus which ones will sound pleasant or unobtrusive, is still an inexact science at best.  Therefore, vehicle designers are required to produce multiple prototypes and test them acoustically before bringing a product to market.  Our Phase II product will give these designers, and even their decision-making managers, the ability to hear prototypes in service before they ever leave the electronic drawing board, saving significant costs in the product prototype mockup stage."
