Proposal Number,Phase 1 Contract #,Subtopic Title,Proposal Title,Small Business Concern_Firm,Small Business Concern_Address,Small Business Concern_Phone,Principal Investigator_Name,Principal Investigator_E-mail,Principal Investigator_Address,Principal Investigator_Phone,Business Official_Name,Business Official_E-mail,Business Official_Address,Business Official_Phone,TRL_Begin,TRL_End,Technical Abstract,Potential NASA applications,Potential non-NASA applications
02-2 H5.03-9178 (For NASA Use Only - Chron: 022821 ),NAS1-03042,"Non-Destructive Evaluation, Health Monitoring and Life Determination of Aerospace Vehicles/Systems",Exploiting Unusual Characteristics of Photonic Crystals for Novel Optical Device,Intelligent Fiber Optic Systems Corporation,"650 Vaqueros Ave., Sunnyvale , CA   94085 - 1260",(408 ) 328  - 8610,Behzad Moslehi,bm@ifos.com,"650 Vaqueros Ave., Sunnyvale , CA   94085 - 3525",(408 ) 328  - 8648,,,,,,,"In Phase I, IFOS designed, built, and demonstrated a novel type of compact, lightweight, fast, ultra-high- resolution wavelength spectrometer. The central element of the spectrometer is based on innovative photonic crystal designs. These types of materials or structures can possess ultra-high dispersive properties and thus yield high levels of spectral resolution (picometer), in a very compact volume (1mm2 x 0.5 mm) and lightweight package (<100 grams).  In Phase II, we will optimize the design to miniaturize the packaging for enhanced performance and more design flexibility, enabling new and improved NASA missions and science measurement capabilities. Extensive reliability testing will be performed to validate the capability of the proposed spectrometer to NASA standards. By tailoring the thickness of each layer, numerically according to design specifications, the spatial dispersion of the device is maximized.  Going a step beyond the periodic photonic crystal approach, IFOS will obtain the decisive technical advantage to make this revolutionary spectrometer a superior product. IFOS will integrate all sub-components into an ultra-compact, lightweight and robust package, yielding ultra-high performance.","Photonic devices are robust and able to survive hostile environments. The compact, lightweight, and rugged nature of the proposed photonic-crystal spectrometer is ideal for aerospace applications, minimizing impact on vehicle payload, such as in-flight monitoring systems without vehicle performance degradation. These spectrometers have a variety of onboard applications, providing critical elements in the signal analysis for physical and chemical sensors, including the fast detection and super-high-resolution spectrometry of various gases (e.g., ammonia, hydrogen, hydrazine, carbon-dioxide, oxygen) with a fast response time. The IFOS spectrometer enables new scientific instruments, fitting into NASA?s Strategic Goal of ?Enabling revolutionary capabilities through new technology.?","The developments of this proposal will result in the commercial availability of a revolutionary, ultra-compact spectrometer. The small size, lightweight and ruggedness will make the spectrometer an ideal candidate for all mobile applications, such as environmental monitoring, plasma, gas and other material analysis, biomedical and forensic studies, and safety needs (such as detection and analysis of biological agents or explosives). In addition, this effort will establish photonic crystal technology itself as commercially viable and thus open the door for additional photonic crystal devices. Commercial applications of this technology also include high-speed telecommunications and optical data processing."
02-2 H6.02-8697 (For NASA Use Only - Chron: 023302 ),NAS9-03035,Distributed/International Ground Operations,Remote On-demand Networked Distributed Operations (RONDO),"mobileFOUNDATIONS, Inc.","103 W. Broad Street, Suite 600, Falls Church , VA   22046 - 4237",(703 ) 532  - 9615,Jeffrey Fox,jfox@mobilefoundations.com,"103 W. Broad Street, Suite 600, Falls Church , VA   22046 - 4237",(703 ) 532  - 9615,,,,,,,"Remote On-demand Networked Distributed Operations (RONDO) is a set of Web-based transformational technologies that provides situation awareness to distributed Space Station operations and support personnel.  RONDO consists of: (1) an incident/event monitoring and alerting subsystem that autonomously monitors for and logs ?events of interest,? wirelessly sends (alerts) the event data to the appropriate personnel, and performs all notification, roll-over, and tracking functions, and (2) a real-time collaboration subsystem that enables remote personnel to become members of a distributed ?virtual? team by providing secure and reliable access to data, products, systems, and personnel located in the MCC, providing a ?window into the MCC.?  By enabling personnel to perform their work where they are most efficient and effective, small distributed teams can perform the same high level and quality of work as today?s large teams.  In its Phase I SBIR, mobileFOUNDATIONS proved the feasibility RONDO by building, testing, and demonstrating a RONDO prototype.  In Phase II, mobileFOUNDATIONS will build RONDO, tailor its capabilities to the needs of the users, and perform the integration and testing to ensure that RONDO will work in the current and future Web Portal architectures.","The primary NASA use of RONDO will be for mission operations.  RONDO has received positive feedback from NASA personnel from JSC, GSFC, and Ames.  While RONDO is being funded for human exploration missions, it will be equally useful for all types of spacecraft.  Outside of mission operations, NASA can use RONDO for network monitoring, help desk support, base security, search and rescue, distributed science and sensor monitoring, distributed training, and facilities management.","Some non-NASA RONDO applications include: homeland security, public safety, equipment monitoring, network monitoring, cybersecurity, military command and control, and building monitoring.  Initially, mobileFOUNDATIONS plans to transfer the RONDO technologies into its homeland security application, IncidentPortal, to improve wireless communications interoperability and interagency collaboration."
02-2 H6.02-9139 (For NASA Use Only - Chron: 022860 ),NAS9-03036,Distributed/International Ground Operations,Distributed Operations Software for Wireless Handheld Computers,"TenXsys, Inc.","4068 Wisteria Way, Boise , ID   83713 - 2682",(208 ) 250  - 0211,Layne Simmons,layne@tenxsys.com,"4068 Wisteria Way, Boise , ID   83713 - 2682",(208 ) 250  - 0211,,,,,,,"This TenXsys NASA SBIR project focuses on an innovative software solution that allows complex real-time data streams to be viewed as information on devices.  The TenXsys solution allows access to data anywhere, anytime using wireless transmission to a web enabled handheld device such as a personal data assistant (PDA), laptop, or cell phone.  This will allow distributed operations of missions, will reduce cost of operations by reducing the number of required personnel in the control center, and will allow an avenue for people to view operational data in real-time.  TenXsys? ADROIT software is categorized as a middleware product with enabling specialty software specific to each command and control center.   Broadly defined, middleware enables one application to communicate with another through functions such as conversion, translation, consolidation or integration.TenXsys innovations will allow:  Remote and mobile  real-time data display outside of the control center  Data collection & processing  Display configurability on-the-fly  Information presentation versus data  Situational and contextual awareness","The TenXsys ADROIT solution will allow insight into flight, crew and vehicle data enabling remote operations and data monitoring.  The proposed system will have application for NASA for viewing data streams external to the active Mission Control Center (MCC) or Mission Evaluation Room (MER) environment.  For example, biomedical data could be accessed in real-time, allowing a flight surgeon the flexibility of reviewing the data without being near the control center.  NASA control centers that focus on manned or unmanned spaceflight and science operations will use the ADROIT solution to allow situational and contextual awareness as well. The ADROIT software will facilitate remote operations during these missions, reducing cost while increasing capabilities.","The innovation also will benefit wide ranging applications at other government agencies and commercial enterprises.  The military branches are all working to transform their teams to a networked force.  As a part of this effort, advanced tools that provide distributed common ground systems for intelligence data fusion, as well as visualization tools for complex data that allow for built-in alerts and pattern recognition are in demand.  Additionally, with the new emphasis on Homeland Defense and Security, the ability to quickly transmit data, share information, and receive alerts allow first responders and others to continue operations outside of normal work facilities.  As these devices become more location aware, more directed situational and contextual data can be communicated.   The commercial market for wireless PDA based applications for command and control operations is virtually untapped.  Telecommunications, power management, traffic control, or emergency management control rooms are all potential customers of the ADROIT software solution. Each of these critical nerve centers has to handle large amounts of constantly changing visual data. Although the data and the process being controlled will be different, there are a few core requirements for nearly all such facilities.  Our ADROIT middleware will be applicable to any of these centers."
02-2 H7.02-9616 (For NASA Use Only - Chron: 022383 ),NAS8-03029,Unmanned Autonomous Rendezvous Systems,Rendezvous and Docking Sensor Suite,"Advanced Optical Systems, Inc.","6767 Old Madison Pike, Suite 410, Huntsville , AL   35806 - 2181",(256 ) 971  - 0036,Stephen Granade,granade@aos-inc.com,"6767 Old Madison Pike, Suite 410, Huntsville , AL   35806 - 2181",(256 ) 971  - 0036,,,,,,,"In recent decades, NASA?s interest in spacecraft rendezvous and proximity operations has grown. Additional instrumentation is needed to improve manned docking operations? safety, as well as to enable telerobotic operation of spacecraft or completely autonomous rendezvous and docking. To address this need, we propose a suite of active sensors that will provide range and bearing information to a docking craft at distances of kilometers, and will provide 6-degree-of-freedom information at distances of hundreds of meters. The suite of sensors will include NASA?s Advanced Video Guidance Sensor (AVGS) for short-range operations, and will build on that sensor?s flight heritage by adding a laser range and bearing finder (RBF). There is a need for a laser RBF that can operate to distances of 5 km; currently, no such space-qualified RBF exists. For this reason we propose building a wide-angle laser RBF. The wide angle removes the need for scanning systems such as gimbals, eliminating moving parts and making the sensor simpler and space qualification easier. The RBF will work from 5 km in to distances on the order of tens of meters, an operating range that will allow it to mesh with AVGS, and with a range accuracy of 1 m.","During Phase I of the project, we developed and distributed a survey that documented several potential NASA-related applications and programs where our sensor suite might play a role. The Orbital Space Plane will be non-crewed for its first two years, making docking sensors such as our Rendezvous and Docking Sensor Suite (RDSS) a vital part of the program. Orbital Express plans currently call for use of AVGS, demonstrating the program?s need for docking sensors such as our proposed laser rangefinder. A similar need exists for the Alternate Access to Station project. RDSS could be used in the Mars Sample Return Mission for docking and landing. Finally, RDSS could be used for docking with satellites.","Range measurements and autonomous docking are not solely NASA requirements. The ability to bring two objects together autonomously has several potential applications in the military. RDSS could be used in autonomous cargo loading and unloading, for in-air or at-sea fleet refueling, and for long-haul transport. The booming UAV/UGV (Unmanned Air/Ground Vehicles) market is in desperate need of docking/landing solutions that the RDSS application is perfectly suited for. Non-military commercial applications include docking a yacht at a pier or in a berth, tractor/trailer docking, and robotic delivery."
02-2 H7.03-9809 (For NASA Use Only - Chron: 022190 ),NAS9-03037,Propulsion Systems Ground Test Operations,Fabrication and Test of HTS Coils for the VASIMR Experiment,Tai-Yang Research Corporation,"31 Pierson Dr., Hockessin , DE   19707 - 1029",(302 ) 494  - 4048,Dr. Chris Rey,taiyang@tai-yang.com,"31 Pierson Dr., Hockessin , DE   19707 - 1029",(302 ) 494  - 4048,,,,,,,"In the Phase I effort, Tai-Yang Research Corporation (TYRC) proposes to design and perform analyses on state-of-the-art High Temperature Superconducting (HTS) coils for the Variable Specific Impulse Magneto-Plasma Rocket (VASIMR) experiment being conducted at the Advanced Space Propulsion Laboratory (ASPL) at the NASA Johnson Space Center. Using the design results obtained in the Phase I effort, TYRC proposes in Phase II to fabricate, test, and install HTS coils (VX-2 and VX-3) in the existing VASIMR experiment. Replacing the conventional copper coils with state-of-the-art HTS coils in the VASIMR experiment will allow for greater design flexibility and increased operational performance. The HTS replacement coils will be designed to be conduction cooled via a single-stage Gifford-McMahon (G-M) cryocooler, operating at ~ 40 K.",HTS magnets offer the poetntial for signiifcantly lighter weight and reduced electrical power consuptions over their conventional and LTS counter-parts. HTS magnets introduced into other NASA applications such as adiabatic refrigeration experiments off a significantly lighter systems package.,"HTS magnets offer the poetntial for signiifcantly lighter weight and reduced electrical power consuptions over their conventional and LTS counter-parts. Due to their less tringent cryogenic insulation and cooling requirements HTS based products are now making commercial in-roads in the development of HTS based : motors, generators, fault current limiters, magnetic separators, transformers, and ac/dc cables."
02-2 S1.02-8217 (For NASA Use Only - Chron: 023782 ),NAS5-03061,Deep Space Propulsion,Sputter-Resistant Materials for Electric Propulsion,"Energy Science Laboratories, Inc.","6888 Nancy Ridge Dr., San Diego , CA   92121 - 2232",(858 ) 552  - 2032,Timothy Knowles,tknowles@esli.com,"6888 Nancy Ridge Dr., San Diego , CA   92121 - 2232",(858 ) 552  - 2034,,,,,,,"This SBIR Phase 2 project shall develop sputter-resistant materials for use in electric propulsion test facilities and for plume shields on spacecraft using electric thrusters.  A critical need arises because NASA is developing higher impulse, higher power thrusters for deep space science missions.  Such thrusters will erode chamber walls ten-times more aggressively than before and create unacceptably high levels of contamination in the life test facilities. Without new materials that are ten-times more resistant than graphite, the only alternative may be installation of larger vacuum test chambers at huge facility cost.   The proposed sputter-resistant materials are based on carbon fibers in a highly textured configuration that allows deep penetration of incident ions and trapping of sputtered secondary atoms.  Phase 1 testing has demonstrated a 5x reduction in sputter backflow toward the ion source, consistent with modeling predictions. It appears feasible to extend the use of existing test facilities at least into planned near term testing of next generation ion engines.   Phase 2 will develop thicker low-contamination chamber liners intended for long duration exposure, and modeling tools will be developed to aid in the design of baffled chamber liners. Lightweight rigid plume shields for spacecraft using EP will be demonstrated and offered for testing. Removable, cleanable, liner configurations will be demonstrated for use  with condensable liquid metal propellants. Sputter testing will be performed by CSU using hemispherical witness plates to rapidly acquire directional yield data. Low-contamination chamber liner materials designed for use in testing high current, high voltage ion sources will be delivered under the contract for evaluation by NASA.","Sputter-resistant materials have immediate application in NASA ground test facilities devoted to life testing high current, high voltage electric propulsion thrusters.","Sputter-resistant materials have broad applications where ion sources are used. Plume shields are needed to protect spacecraft surfaces from sputtering by An immediate application is as plume shields shields on spacecraft using electric propulsion, fusion reactor first walls, pulsed power diodes, ion current probes, and broad commercial application in facilities that perform materials processing with sputter sources."
02-2 S1.03-9223 (For NASA Use Only - Chron: 022776 ),NAS1-03044,Multifunctional Structure and Sensor Systems,SensorLine: A Distributed Sensor System for Planetary Exploration,Tethers Unlimited,"19011 36th Ave W. Suite F, Lynnwood , WA   98036 - 5752",(425 ) 744  - 0400,Jeffrey T. Slostad,slostad@tethers.com,"19011 36th Ave W. Suite F, Lynnwood , WA   98036 - 5752",(425 ) 744  - 0400,,,,,,,"The SensorLine is a small, simple, low-cost system for deploying arrays of tethered microsensors for planetary, asteroid, and subsurface exploration.  The SensorLine system integrates the microsensors into a thin, lightweight tether that provides both power and communication.  In planetary exploration applications, the SensorLine?s novel deployment method permits these sensors to be distributed over long distances on a planetary surface, enabling planetary landers to obtain in situ thermal, chemical, seismic, and other measurements over a much wider area at a significantly lower cost, complexity, and technical risk than robotic rovers. In exploration of the lunar poles, the SensorLine could enable a probe placed on a sunlit hill to obtain in situ measurements of soil composition in a permanently shaded crater.  In subsurface exploration applications such as the proposed Cryoscout experiment, the SensorLine system can provide power, communications, and distributed sensing capabilities for burrowing probes.","The SensorLine System will provide a low-cost, lightweight multifunctional sensor system that will enable NASA?s robotic missions to obtain in-situ thermal, chemical, seismic, and other measurements in areas that currently are inaccessible or very difficult to reach with current robotic technologies.  Enabled missions include lunar polar crater exploration, Mars surface and subsurface missions such as the Cryoscout and Mars Dust Devil investigations, study of asteroid surfaces, and balloon missions at Venus and Jupiter.","The SensorLine System and its derivative technologies have numerous potential applications in the environmental, military, and consumer markets.  In environmental testing and safety markets, this system will provide a low-cost means for rapidly deploying sensors into areas where it is unsafe or impossible for humans to collect measurements manually, such as in emergency response to chemical spills.  In military markets, it will provide a means for troops in unsecured areas to rapidly deploy sensors to detect chemical or biological weapons and to detect intrusion by hostile forces, as well as a robust communications link for sensors mounted on penetrators."
02-2 S1.03-9862 (For NASA Use Only - Chron: 022137 ),NAS5-03062,Multifunctional Structure and Sensor Systems,Radiation tolerant non volatile memory with Hard by Design Techniques,"NxGen Electronics, Inc.","9765 Clairemont Mesa Blvd. Suite A, San Diego , CA   92124 - 1324",(858 ) 309  - 6610,David Strobel,dstrobel@nxgenelect.com,"9765 Clairemont Mesa Blvd, Suite A, San Diego , CA   92124 - 1525",(858 ) 309  - 6610,,,,,,,"NxGen Electronics Inc proposes to research and rapidly develop radiation hardened non volatile memory microelectronics, based on commercial ferroelectric technolgy. These FRAMs exhibit excellent radiation performance in the memory cell but are extrememly sensitive in the peripheral circuitry. We will apply hard-by-design techniques, with the support of Celis Semiconductor, to develop a rad hard version for space and military applications.In Phase II this design will be fabricated on one of Ramtron's licensees wafer fab. To address the high density needs, NxGen Electronics will design several MCM and stacked memory configurations using advanced packaging technology.","Virtually all NASA space programs have a demand for dense, rad hard non-volatile memory. These applications range from shuttle, space station, earth sensing missions and deep space probes. The world's most common 1 megabit EEPROM just became obsolete, creating an immediate demand for radiation guaranteed non-volatile memory ICs. Some of the NASA missons which will benefit are Mars Surveyor missions, solar system exploration e.g. (Titan, Europa landers,comet nucleus return), New Discovery Program, and Living with a Star.","A Radiation hardened high density non-volatile memory device is a key component for any commercial system in a radiation environment. These applications include commercial space platforms, both GEO and LEO such as the Boeing Space HS-601 and Lockheed A2100. Telecommuncation satellites and sensing applications (NOAA)require this memory to store critical data and support on board data processing. New Missile Defense Agency (MDA) interceptor programs will likely have radiation requirements. Terrestial applications include nuclear power plants and research accelerators (Fermi Lab). A potentially large market are commercial aircraft avionics which are becoming increasingly sensitive to single event effects (SEE) as commercial IC feature sizes and voltages decrease."
