Proposal Number,Phase 1 Contract #,Subtopic Title,Proposal Title,Small Business Concern_Firm,Small Business Concern_Address,Small Business Concern_Phone,Principal Investigator_Name,Principal Investigator_E-mail,Principal Investigator_Address,Principal Investigator_Phone,Business Official_Name,Business Official_E-mail,Business Official_Address,Business Official_Phone,TRL_Begin,TRL_End,Technical Abstract,Potential NASA applications,Potential non-NASA applications
02-2 E1.07-8301 (For NASA Use Only - Chron: 023698 ),NAS5-03059,Thermal Control and Cryogenic Systems,Self-Contained Distributed Cooling Module for High Heat Sources,"MicroEnergy Technologies, Inc.","2007 E. Fourth Plain Blvd., Vancouver , WA   98661 - 3957",(360 ) 694  - 3704,Dr. Reza Shekarriz,reza@microet.com,"2007 E. Fourth Plain Blvd., Vancouver , WA   98661 - 3957",(360 ) 694  - 3704,,,,,,,"MicroEnergy Technologies, Inc. (MicroET) is proposing to develop a self-contained and autonomous thermal management system for distributed cooling of microelectronics.  The problem of managing the heat load from multiple discrete heat sources within electronic systems is becoming a growing problem and receiving attention not only at NASA but at DoD and within the commercial sector.  In this project, we have demonstrated the feasibility of developing a state-of-the-art autonomous cooling module that could be used in a network for thermal management of discrete and distributed electronics.  The cooling module takes advantage of liquid cooling, pumped with a highly efficient built-in micropump integrated within the cooling module, to deliver more than 100 W/cm^2 of cooling.  The two critical components, the heat sink and the liquid transport pump, were tested, integrated in a single package and independently for phase I feasibility demonstrations.  For Phase II, MicroET is teaming with the University of Washington and Technology Assessment and Transfer (TA&T) to develop and demonstrate a breadboard prototype during the first year followed by a brassboard prototype made of a ceramic monolith structure during year 2 of the project.   Our team brings to the table expertise in system engineering and development, fluid dynamics and heat transfer, and ceramic microfabrication.  As described in the commercialization section of this proposal we have developed necessary partnerships and intellectual property to successfully manufacture and commercialize our electronics cooling products during phase III.","MicroET?s mission is to develop an autonomous, highly efficient, hermetically sealed cooling module.  Our longer term goal is the development of thermally-actuated autonomous cooling modules that eliminate the use of external power to drive the liquid in the loop.  As part of this mission, we are being funded from various sources to develop various components of our technology.  However, our product during the NASA SBIR Phase II project will be two different prototypes targeted to meet specific needs within NASA.  We expect that our product will have its highest impact in the following NASA programs: FPGA chip, micro/nano spacecraft, high density avionics, expandable and planar lidar/radar arrays, and miniature fuel cells.","The proliferation of consumer microelectronics and the relentless progression of Moore?s Law offer numerous market opportunities for advanced thermal management systems. The waste heat fluxes from consumer-grade microprocessors are approaching 100 W/cm^2 and this trend shows no sign of slowing down. A mass-produced version of the MicroET cooling module could be cost-competitive with today?s most advanced cooling solutions, but would exhibit significantly better performance than the current state-of-the-art. There are extensive application opportunities in personal computers, network servers, supercomputers, embedded computing devices, and a wide range of telecommunications equipment. Wide band gap semiconductors have been the subject of a great deal of research and development work in recent years. The Department of Defense has a number of ongoing programs to use these semiconductors in phase array radar and similar high-energy applications. While wide band gap materials have some distinct advantage, they also generate large quantities of waste heat, with fluxes approaching 1000 W/cm^2. A high-performance distributed cooling system is imperative for the operation of such systems.  High power lasers are in use in numerous military, scientific, and industrial applications ? some with extremely large waste heat fluxes (1000 W/cm^2 and greater). As with wide band gap semiconductors, a high-performance thermal management system is absolutely necessary."
02-2 E1.07-8993 (For NASA Use Only - Chron: 023006 ),NAS5-03025,Thermal Control and Cryogenic Systems,Low-Current Superconducting Magnets Operating at up to 10K,"Superconducting Systems, Inc.","90 Rumford Avenue, Waltham , MA   02453 - 3847",(781 ) 642  - 6702,Shahin Pourrahimi,pourrahimi@superconductingsystems.com,"90 Rumford Avenue, Waltham , MA   02453 - 3847",(781 ) 642  - 6702,,,,,,,"Our overall goal for this project is to develop the technologies necessary for fabrication of efficient cryogen-free superconducting magnets that can operate at temperatures of 6-10K. In the Phase I program, we demonstrated that an efficient solenoid magnet system may be built using small diameter Nb3Sn wires employing the react-and-wind approach. In the Phase II program we will fabricate model 3T magnets operating at 10K with currents of 8A, 5A and 3A. The magnet will be tested and then used by NASA in an ongoing R&D in the area of Adiabatic Demagnetization Refrigeration.",Highest efficiency adiabatic demagnetization refrigerators useful for achieving very low temperatures in space missions require superconducting magnets with low operating current that workat temperatures in the range of 6-10K. This program is geared toward the development of technologies for manufacturing of such magnets.,"This program will establish practical and economical technologies in the areas of superconductor, and superconducting magnet technologies for operation at 6-10K. The results will impact the design, fabrication, and use of superconducting magnets for applications in space, high energy physics, medical, low temperature physics, spectroscopy, imaging, and chemistry."
02-2 E1.07-9079 (For NASA Use Only - Chron: 022920 ),NAS2-03127,Thermal Control and Cryogenic Systems,High Efficiency MEMS Based Cryocooler,"Nanohmics, Inc.","6201 East Oltorf St, Suite 100, Austin , TX   78741 - 7511",(512 ) 389  - 9990,Keith Jamison,kjamison@nanohmics.com,"6201 East Oltorf St, Suite 100, Austin , TX   78741 - 7511",(512 ) 389  - 9990,,,,,,,"In this SBIR program,  Nanohmics is developing an ultrahigh efficiency MicroElectroMechanical System (MEMS) cryogenic cooling system.  The cryocooler is based on a Stirling Engine that is operating in reverse mode (mechanical-to-thermal) transduction.  These devices show particular promise as MEMS coolers for integrated circuits and other planar detection arrays.  This program improves on past work to develop a MEMS-based Stirling cryocooler that will dramatically improve the cryocooler performance and simplify device construction.  The improvements to be included in this program are replacing the silicon heat exchanger plates and flexible membranes with high thermal conductivity diamond and monolithically constructing the gas impervious walls and regenerator portion of the device using quartz (SiO2).  In Phase I of this program, Nanohmics examined the effects of introducing these materials into Stirling cryocoolers in the MEMS setting.  This included thermal modeling of the proposed structure and examination of the operating parameters to produce optimum performance.  Nanohmics also developed the process steps necessary to fabricate the device.  In Phase II Nanohmics proposes to fabricate and test a prototype device based on the Phase I design.","To fulfill NASA?s Earth Science Enterprise mission objectives, Nanohmics plans to develop an ultrahigh thermal efficiency MicroElectroMechanical System (MEMS) cryogenic cooling system.  The system will be designed to decrease the cost and size of cooling devices for instruments that perform Earth Science measurements and thus lead to compact electromagnetic detection and microelectronics platforms for integration into miniature probe spacecraft.  Additional NASA applications include dependable long term cooling for detectors on deep space satellite missions.  The proposed MEMS cooler will be highly reliable, light weight, have low vibration, and energy efficient.","Miniaturized coolers have many military and commercial applications. The largest commercial application is cooling of microprocessors and detectors. Currently, speed of microprocessors and the efficiency of detectors are limited by the amount of power that can be removed from the devices. Chip scale heat pumps will allow efficient cooling of devices enabling operation at greater speeds / power densities.  A number of examples exist where a MEMS-based cryocooler integrated into compact environments would be useful.  These include: IR and other electromagnetic radiation detector cooling and cooling of packaged microelectronic chips."
02-2 E2.01-9200 (For NASA Use Only - Chron: 022799 ),NAS9-03019,Structures and Materials,Hierarchial composites comprising continuous carbon nanotube composite fibers in a nanotube-reinforced matrix,ZYVEX Corporation,"1321 N. Plano Road, Richardson , TX   75081 - 2475",(972 ) 235  - 7881,Jian Chen,shachelle@zyvex.com,"1321 North Plano Road, Richardson , TX   75081 - 2426",(972 ) 235  - 7881,,,,,,,"NASA requires dramatic advancements in material properties to improve launch vehicles, spacecraft, and the space station?s performance. Our plan is to provide: 1) Continuous carbon nanotube (CNT) composite fibers stronger than 10 GPa and tougher than any known material. 2) CNT fiber composites stronger than 6 GPa.  We propose to develop hierarchical composites comprising continuous CNT composite fibers in CNT-reinforced matrices (CPMs).  We plan to: (1) Produce continuous CNT fibers with tensile strength >10 GPa and toughness >1000 J/g; (2) Develop CPMs optimized for application with CNT composite fibers; (3) Integrate continuous CNT fibers with CPMs to produce CNT fiber/CPM composites with tensile strength of > 6 GPa, twice the specific strength of carbon fiber/epoxy composites, and a toughness higher than any known material.This program builds on two recent breakthroughs. Zyvex?s CNT solubilization technique dramatically increases organic solubility of CNTs without degrading their properties. A 5% loading of CNTs triples the tensile strength of cast epoxy. The UTD group produced continuous CNT composite fibers having quadruple the specific strength and double the modulus of the best steel wire and 20 times the toughness. These fibers provide a toughness of 600 J/g, much higher than any previously known material.","*Lightweight, multifunctional structural components for aerospace vehicles that will enable increased strength and longevity, improved energy efficiency, and improved vehicle payload mass to lift-off mass ratios. *Multifunctional structural components for the space station (examples include skins, struts, and other structural members that combine strength, insulation, and shielding). *Advanced materials for fabrics and coatings used in space suits and other space applications. *Coatings and bonding agents for high-value components and equipment (examples include EMI shielding materials, ESD protection, ultra-strong adhesives, and conductive coatings for aerospace systems and components). *Composites for satellite armor.","*Advanced materials for medical applications such as fabrication of prostheses and splints.  *Structural components for high-value civilian transportation applications (for example, more extensive use of composites for airframes, helicopter rotors, and skins). *Lightweight, multifunctional fabrics for soldier uniforms, armor, and helmets. Current technology for soldier armor relies on a combination of Kevlar layers and ceramic inserts. We believe that CNT composite fabrics with strength properties exceeding Kevlar can be exploited to reduce the reliance on ceramic inserts, thereby reducing the overall weight and bulk of soldier armor. *Professional sports and leisure equipment such as golf clubs, fishing rods, and tennis equipment. *Advanced flywheels capable of significantly higher rotational speeds *Materials for competitive yachting and car racing"
02-2 E2.02-9627 (For NASA Use Only - Chron: 022372 ),NAS5-03027,"Guidance, Navigation and Control","A Reconfigurable, Decentralized Framework for Formation Flying Control",Princeton Satellite Systems,"33 Witherspoon St., Princeton , NJ   08542 - 3207",(609 ) 279  - 9606,Joe Mueller,jmueller@psatellite.com,"33 Witherspoon St., Princeton , NJ   08542 - 3207",(763 ) 561  - 9613,,,,,,,"The paradigm shift of using a multiple-satellite cluster rather than a large, monolithic spacecraft has been fueled by the objectives of increased robustness, greater flexibility, and reduced cost. It should be understood, however, that these objectives are not automatically met. The operational costs of monitoring and commanding a large fleet of close-orbiting satellites is likely to be unreasonable unless the onboard software is sufficiently autonomous, robust, and reconfigurable. A decentralized, agent-based guidance and control system has been designed in Phase I to help meet these challenging software requirements.  The proposed concept is a decentralized guidance and control system, organized in a multiple-team framework, and implemented within the Princeton Satellite Systems? (PSS) ObjectAgent? architecture. In the ObjectAgent architecture, Agents may be remotely added, removed or replaced post-launch to increase mission flexibility and robustness. This level of reconfigurability exceeds the state-of-the-art in traditional flight software. The reconfigurable, decentralized system will enable the number of spacecraft in the cluster to change post-launch, will be capable of supporting clusters with large numbers of satellites, and will allow significant software modifications to be made on-orbit in a robust manner.","Two potential NASA applications include the MMS and SIRA missions being planned at Goddard Space Flight Center.  The objective of MMS is to identify the basic plasma processes which control the structure and dynamics of the Earth's magnetosphere. The mission involves 4 spacecraft in HEO, with relative distances ranging from 1 km to several earth radii. The formation control objective is to form the spacecraft into a tetrahedron at apogee.   The purpose of SIRA is to obtain high-resolution measurements of transient phenomena in the solar corona. The proposed mission involves 16 close-orbiting spacecraft, placed either in an Earth-centered DRO or at a libration point. The formation control objective is to provide sustained formations in which the cluster fills the u-v plane perpendicular to the sun-line. Because this mission involves a large number of spacecraft, it seems an ideal candidate for the Decentralized Formation Flying system.","Any mission involving formation flying of cooperative spacecraft is a potential application for this product. While most of the planned formation flying missions known to the public today are research related, the Department of Defense has shown a continued effort to advance formation flying technologies. Potential military applications include stereoscopic imaging of space-based targets and redundant multiple-satellite architectures for missile defense.  A specific example is the TechSat 21 mission, for which PSS has developed a centralized formation flying control system under SBIR funding. Although this program was recently cancelled due to budget issues, the inherent benefits of distributed satellite systems continue to fuel the military interests in formation flying."
02-2 E2.04-8267 (For NASA Use Only - Chron: 023732 ),NAS3-03019,Advanced Communication Technologies for Near-Earth Missions,"High-Frequency, Low-Noise Nitride-Based Power Transistors Grown on Bulk III-N",SVT Associates,"7620 Executive Drive, Eden Prairie , MN   55344 - 3677",(952 ) 934  - 2100,Dr. Amir Dabiran,dabiran@svta.com,"7620 Executive Drive, Eden Prairie , MN   55344 - 3677",(952 ) 934  - 2100,,,,,,,"Electronics circuits that can function in very high temperatures (> 450?C) are needed for a number of applications including automotive and turbine engine control, industrial high-temperature processing, geothermal and deep-well oil drilling, satellite power management systems, and future planetary missions to Venus and Mercury.  The key electronic components for these applications include 1) an instrumentation amplifier to be used in conjunction with different probes and transducers, and 2) a power amplifier for driving motors and actuators. We propose to develop AlGaN-based electronics grown on low-defect substrates for operations at temperatures > 450?C and pressures > 100 atmospheres.","NASA has been pursuing the development of electronic systems for operation under severe conditions, from the extreme cold of deep space to searing heat at the surface of Venus and Mercury.  The proposed GaN-based high-temperature amplifier can provide the required power for different actuators on future NASA landing-vehicles for exploring the surface of these planets.  The high-temperature electronics will also benefit NASA in space based power management systems.","The proposed wide-bandgap high-temperature amplifier, in combination with high-temperature transducers, light emitting devices, and actuators, will have great impact on many industries including, automotive, avionics, nuclear power plants, combustion system, and oil and geothermal well drilling."
02-2 E2.05-7736 (For NASA Use Only - Chron: 024263 ),NAS3-03009,On-Board Propulsion,Pulsed Plasma Thruster Piezo-Igniter for Small Satellite,"Face Electronics, LC","427 West 35th Street, Norfolk , VA   23508 - 3201",(757 ) 624  - 2121,ALFREDO VAZQUEZ CARAZO,alfredo@faceco.com,"427 West 35th Street, Norfolk , VA   23508 - 3201",(757 ) 624  - 2121,,,,,,,"The proposal addressed the development of a novel discharge initiation (DI) system for application in small satellites (<40kg). Phase I has successfully demonstrated the potential of the technology for reducing onboard propulsion system mass and volume compared to current DI systems. The design eliminates, for the first time, the conventional discharge capacitor and the magnetic-transformer (bulky and EMI noisy) with a compact and highly efficient technology based on Face piezoelectric transformers, Transoner?. The proposal has particular relevance for micro and nano-spacecraft because of their need for advanced propulsion technologies that emphasize system simplicity, integration, low power requirements and minimal mass. The novel system, IGNIT-SONERTM, uses a high frequency (~60kHz) multispark rather than a single DC-capacitive discharge to achieve ignition conditions. This allows optimization of power consumption as well as increasing the reliability of the system. Phase II will integrate and adapt the technology to the specifications of the current PPTs. The piezo-igniter will be directly integrated inside the spark plug housing thus reducing further the final system package size as well as eliminating the high-voltage wiring. The resulting package will be much less complex and less expensive. This package will be flight-qualified in Phase III.","The resulting revolutionary PPT piezo-igniter concept offers unique benefits for the the current programs pursued by NASA. It will help provide critical advanced power technology and space propulsion systems that meet the needs of all NASA Enterprises and Strategic Technology areas, including significant reductions in launch vehicle and spacecraft cost, increased mission capabilities and flexibility, while enabling cost effective utilization and/or exploration. Specifically, the resulting revolutionary PPT piezo-igniter concept offers unique benefits to the current NASA missions for tightly controlled interferometry constellations. Fine impulse bit control achievable with small satellites enhances spacecraft attitude and positional control capabilities, providing enabling technology for optical interferometer spacecraft constellations envisioned for the future. The results of this R&D effort will improve system simplicity, reduce subsystem components, cost and weight, and increase overall thruster efficiency. In addition,  the technology is expected to apply to other propulsion systems of interest for NASA requiring ignition systems such as chemical propulsion.","Interest in small satellites is growing fast worldwide. Businesses, governments, universities and other organizations around the world are starting their own small satellite programs. Smaller satellites offer shorter development times, on smaller budgets and can fulfill many of the functions of their larger counterparts. Consequently, small satellites can complement the services provided by the existing larger satellites, by providing cost effective solutions to specialist communications, remote sensing, rapid response science and military missions and technology demonstrators. Additionally, the results of this R&D will garner interest in many other commercial applications involving high voltage ignition systems. Ignition systems for small engines, automobiles, and aircraft propulsion are some of the examples."
02-2 E2.06-7673 (For NASA Use Only - Chron: 024326 ),NAS3-03027,Storage and Energy Conversion,Lightweight Unitized Regenerative Fuel Cell,"Proton Energy Systems, Inc.","10 Technology Drive, Wallingford , CT   06492 - 1955",(203 ) 678  - 2338,Frano Barbir,fbarbir@protonenergy.com,"10 Technology Drive, Wallingford , CT   06492 - 1955",(203 ) 678  - 2112,,,,,,,"This Small Business Innovation Research Phase II program addresses the development of a Proton Exchange Membrane Unitized Regenerative Fuel Cell (PEM URFC) stack and system for energy storage. The concepts of reduced cell stack weight, developed in Phase I, will be applied to the concept of static water feed/removal being developed by Proton Energy Systems in another program. The Phase II will result in a working 0.5-1 kW brassboard prototype unitized regenerative fuel cell system with significantly reduced weight of the major system components.","Energy storage and conversion for Earth Science platforms, such as airborne platforms (piloted or unpiloted aircraft and balloons), terrestrial platforms, sea surface and subsurface platforms. Energy storage and conversion for space program (spacecraft, vehicles, bases, stations)","Back-up power for telecommunications, computer systems, individual homes, yachts Uninterrupted power supply for remote locations Various vehicles (particularly airborne and underwater)"
