Proposal Number,Phase 1 Contract #,Subtopic Title,Proposal Title,Small Business Concern_Firm,Small Business Concern_Address,Small Business Concern_Phone,Principal Investigator_Name,Principal Investigator_E-mail,Principal Investigator_Address,Is Principal Investigator US Citizen or Permanent Resident,Principal Investigator_Phone,Principal Investigator_Company,Business Official_Name,Business Official_E-mail,Business Official_Address,Business Official_Phone,TRL_Begin,TRL_End,Technical Abstract,Potential NASA applications,Potential non-NASA applications,Technology Taxonomy Mapping,Research Topic,Research Institution Name,Research Institution Address,Research Institution Phone
10-2 T3.01-9872,NNX11CI10P,Technologies for Space Power and Propulsion,Magnesium Hall Thruster for Solar System Exploration,"Busek Co., Inc.","11 Tech Circle, Natick, MA 01760 - 1023",(508) 655-5565,James J Szabo,jszabo@busek.com,"11 Tech Circle, Natick, MA 01760 - 1023",,(508) 655-5565,,,,,,4,5,"TECHNICAL ABSTRACT (Limit 2000 characters, approximately 200 words) The innovation being developed in this program is a Mg Hall Effect Thruster system that would open the door for In-Situ Resource Utilization based solar system exploration. Magnesium is light and easy to ionize. Performance advantages of a Mg thruster include far higher specific impulse and less life limiting erosion. Additional advantages include low propellant cost and low pressure propellant storage. A system efficiency >50% is expected from an optimized, high power Mg HET. More importantly, the Isp for a high efficiency magnesium Hall thruster driven by a 400V power processing unit may exceed 5000s. For a Mars-Earth transfer, the propellant mass savings with respect to a xenon HET system are enormous. Mg can also be combusted in a rocket with CO2 or H2O, enabling a multi-mode propulsion system with propellant sharing and ISRU. In the near term, CO2 and H2O would be collected in-situ on Mars or the Moon. In the far term, Mg itself would be collected from Martian and lunar regolith. In Phase I, an integrated, medium power (1-3kW) Mg HET system was developed and tested. Controlled, steady operation at constant voltage and power was demonstrated. Preliminary measurements indicate Isp >4000 s was achieved at a discharge potential of 400V. The feasibility of delivering fluidized Mg powder to medium or high power thruster was also demonstrated. The objective of Phase II will be to evaluate the performance of an integrated, high power Mg Hall thruster system in a relevant space environment. In the first task, we will improve the medium power thruster system and characterize it in detail. In the second task, the knowledge gained will be used to design and build a high power (8-20kW) Mg HET. In the third task, a fluidized powder feed system supporting the high power thruster will be built and delivered to Busek. In the fourth task, the integrated high power system will be fully characterized. Measurements will include performance and plume properties.","POTENTIAL NASA COMMERCIAL APPLICATIONS (Limit 1500 characters, approximately 150 words) Magnesium Hall thrusters are attractive for NASA Flagship, Frontier, and Discovery class missions because extremely high specific impulse is available at voltages typical of low cost, flight qualified power processors. Isp ~ 5000 s is possible at a discharge potential of 400 V, while Isp ~ 6000 s is possible at 600 V. These thrusters can also be deeply throttled. Examples mission targets include asteroids, comets, and the outer planets. Sample return missions are also enabled. Magnesium thrusters are also well suited for lunar and Martian missions. A high power cluster would support manned missions by transporting fuel and cargo. In-situ propellant utilization is possible at the Moon and Mars. Also possible is a multi-mode Mg based propulsion system featuring a Mg rocket and a Hall thruster will full or partial propellant sharing. This multi-mode system with ISRU would greatly reduce the cost of sample return from Mars.","POTENTIAL NON-NASA COMMERCIAL APPLICATIONS (Limit 1500 characters, approximately 150 words) Light metal Hall thruster technology may enhance many critical DoD and commercial missions such as satellite orbit maintenance, orbit raising and repositioning. Magnesium offers far higher specific impulse than possible with xenon with the possibility of long term, low maintenance, propellant storage. High pressure propellant tanks will not be required and spacecraft interaction issues should be manageable. Mg Hall thrusters could also form one half of a multi-mode propulsion system that also contains a Mg based rocket. This system would provide both high thrust and high Isp. The rocket oxidizer would be CO2 or water. The two systems would share propellant feed system components, tanks, and fuel.",Active Systems; Fuels/Propellants; In Situ Manufacturing; Maneuvering/Stationkeeping/Attitude Control Devices; Resource Extraction; Spacecraft Main Engine,,The Pennsylvania State University,"PO Box 30, State College, PA 16804 - 0030",(814) 865-0305
10-2 T9.01-9906,NNX11CI37P,Technologies for Human and Robotic Space Exploration Propulsion Design and Manufacturing,Advanced Flow Analysis Tools for Transient Solid Rocket Motor Simulations,Tetra Research Corporation,"420 Park Avenue West, Princeton, IL 61356 - 1934",(815) 872-0702,Rex Chamberlain,rex@tetraresearch.com,"420 Park Avenue West, Princeton, IL 61356 - 1934",,(815) 872-0702,,,,,,3,5,"TECHNICAL ABSTRACT (Limit 2000 characters, approximately 200 words) The goals of reducing total cost and increasing reliability and safety of access to space continue to be top priorities for NASA. The most immediate propulsion launch challenge involves increasing lift weight from 70 to 130 metric tons by developing the heavy lift Space Launch System (SLS). Solid rocket motor analysis tools are needed to simulate ignition and propellant recession during the burn, but current models are limited in their ability to capture ignition transients or large grain deformations during motor operation. We propose to advance propellant surface heating, ignition, and burning models as well as surface mesh recession algorithms to address a strong need for improved ignition physics and grain burn back and to deliver a unique and powerful software tool for current and next generation solid rocket motor simulations. The Phase I products have already been fielded by NASA for ignition calculations involving the Launch Abort System Jettison Motor and RSRMV. While these calculations are still in the preliminary stages, continued innovation of this successful technology strongly suggests that our research products will provide NASA with the important capability to simultaneously analyze solid propellant heat transfer, combustion, and grain burn back within a single framework. Validation of the integrated tools to a TRL of 5 will be accomplished using available motor data provided by ATK while phased releases of the new software capabilities will allow NASA immediate access to incremental updates as soon as they are available. Advancing this simulation capability will provide a large benefit to NASA because of its compatibility with NASA's mission and expertise.","POTENTIAL NASA COMMERCIAL APPLICATIONS (Limit 1500 characters, approximately 150 words) This technology will provide NASA with an advanced simulation capability for two phase flows in solid motors with dynamic grain recession, including burning surface particulate injection and volume and mass flow constraints for the receding propellant, to support simulations of launch abort motors, RSRMV, and SLS. NASA customers, such as Wallops Island Launch Facility and the Missile Defense Agency, would also benefit from their use of this innovative technology. Future upgrades to extend the simulation capabilities of commercial interest to NASA would also be possible, including improved droplet/gas interface modeling for better statistical representations of particle laden flows, improved near-wall turbulence modeling, and extended model validation for commercial space launch systems. Future innovation involving our models for material heating and surface mesh recession would also allow treatment of external surface heating and ablation phenomena that are typical of entry, descent, and landing scenarios.","POTENTIAL NON-NASA COMMERCIAL APPLICATIONS (Limit 1500 characters, approximately 150 words) The growing trend toward complex multi-phase solid rocket motor and launch simulations is creating opportunities for enabling analysis tools in the commercial aerospace market. The ability to analyze these difficult problems in a timely manner will allow the commercial launch industry to reduce costs and increase reliability of access to space. DoD and commercial applications include small and medium solid motors, launch simulations, and stage separation. Additional physical modules, such as upgraded Large Eddy Simulation and turbulence-combustion interaction models, could be developed to address specific commercial opportunities with the basic architecture of the software remaining the same.","Launch Engine/Booster; Software Tools (Analysis, Design)",,Mississippi State University,"Engineering Research Center, Mississippi State, MS 39762 - 9627",(662) 325-7404
10-2 T7.01-9980,NNX11CI28P,Wireless SAW Sensor Arrays,Wireless SAW Sensor Strain Gauge & Integrated Interrogator Design,"Mnemonics, Inc.","3900 Dow Road, Suite J, Melbourne, FL 32394 - 9255",(321) 254-7300,Nikolai Kozlovski,nikolai.kozlovski@mnemonics-esd.com,"3900 Dow Road, Suite J, Melbourne, FL 32394 - 9255",,(321) 254-7300 Extension :2308,,,,,,3,6,"TECHNICAL ABSTRACT (Limit 2000 characters, approximately 200 words) The proposed Wireless, passive, SAW sensor system operates in a multi-sensor environment with a range in excess of 45 feet. This proposed system offers unique features in two (2) important areas. The first is in the development of a new sensor type, a strain gauge that is based on OFC techniques and implemented with the low loss characteristics of SAW Unidirectional transducers. The second is in the design of an integrated interrogator system that has DSP-based embedded signal processing. Interrogator will also be capable of rapidly performing multiple interrogations which can them be used to make ibration measurements or averaged to extend the operational range of the system. This proposal extends the Phase I and previous work in two major areas; developing a SAW strain sensor, and dramatically increasing interrogation range, which is applicable to both the new strain sensors and the previously developed temperature sensors. In order to increase SAW sensor range, sensitivity and accuracy, the most important device parameters were identified and initial investigation begun in Phase I and will be put into practice in Phase II. To reduce SAW sensor loss and minimize multi-transit acoustic echoes, low loss unidirectional studies were initiated. Phase I produced three alternative low-loss approaches that will be evaluated in the Phase II work. Success will lower the insertion loss by approximately 15 dB, and multi-transit echoes are predicted to be less than -40 dB from the main signal; doubling the system range and reducing the sensors self-noise. Advanced coding techniques were investigated in Phase I that have led to longer delay path lengths, and shorter codes with less inter-sensor interference.During Phase II, the interrogator will improve the following critical capabilities: onboard-fully-integrated DSP, extended connectivity options to customer's computer, and rapid interrogation capabilities. This will allow vibration sensing and signal integration.","POTENTIAL NASA COMMERCIAL APPLICATIONS (Limit 1500 characters, approximately 150 words) A wireless, passive, coded sensor that is rugged, cheap and can be remotely interrogated has multiple applications at NASA. Temperature, pressure and acceleration sensors can be installed on the leading edges of wings to monitor temperature, pressure loss and also provide a profile of the forces on the structure. Additional NASA applications include acceleration sensing for monitoring vehicular acceleration and vehicular vibration, vehicular docking, rotation and directional sensing, tilt control, and fall detection. By exploring the future use of SAW devices for monitoring structural integrity, extreme temperature, extreme pressure, toxic or lethal environments, it is highly probable that the wireless SAW can change the future of Airframe safety and the required/planned maintenance process. This technology can allow the feasible embedment of sensors in key structural components of an airframe for persistent monitoring both during flight and as a post flight analysis. Not only could the structural integrity of the airframe be monitored but other critical states of air flight could be instrumented without the increased cost of weight associated with fiber optic or wired communication.","POTENTIAL NON-NASA COMMERCIAL APPLICATIONS (Limit 1500 characters, approximately 150 words) Potential Non-NASA commercial include the Automotive Industry (state of health), Civil Engineering (stress management), Chemical and Biological development (toxic safety monitoring) and Refinery process (safety monitoring). The utilization of a wireless SAW device for remote monitoring of hostile environments will become not only technically feasible but also economically feasible based on the extremely low cost associated with the device. By establishing the WSAW as a passive device and the wireless interrogator as the active portion of the link you have enabled an architecture which can support the monitoring of possibly hundreds of SOH sensors per interrogator. As an example in an automobile the wireless SAW can be deployed as pressure sensors in each tire, liquid contaminant sensors in the fuel and oil supplies, temperature and pressure sensors within the engine, and carbon monoxide sensors within the vehicle. Additionally, highway safety information could be deployed with each informational sign or within construction areas to alert the driver of a status change of speed or other conditions which could be interrogated by the onboard system.","Acoustic/Vibration; Chemical/Environmental (see also Biological Health/Life Support); Diagnostics/Prognostics; Navigation & Guidance; Nondestructive Evaluation (NDE; NDT); Positioning (Attitude Determination, Location X-Y-Z); Ranging/Tracking; Sensor Nodes & Webs (see also Communications, Networking & Signal Transport); Spacecraft Design, Construction, Testing, & Performance (see also Engineering; Testing & Evaluation); Thermal",,University of Central Florida,"12201 Research Pkwy., Suite 501, Orlando, FL 32816 - 3246",(407) 823-3031
10-2 T4.01-9931,NNX11CI18P,"Lidar, Radar, and Passive Microwave",New Lidar Laser Configuration for Earth Science Measurements,"Fibertek, Inc.","13605 Dulles Technology Drive, Herndon, VA 20171 - 4603",(703) 471-7671,Youming Chen,ychen@fibertek.com,"13605 Dulles technology Drive, Herndon, VA 20171 - 4603",,(703) 471-7671 Extension :3707,,,,,,4,6,"TECHNICAL ABSTRACT (Limit 2000 characters, approximately 200 words) In this STTR Phase 1 program, Fibertek successfully developed and demonstrated a breadboard version of a pulsed fiber laser capable of high-spectral resolution lidar (HSRL) measurements. This was installed in the Lidar Lab. at the Univ. of Maryland, Baltimore county (UMBC). Lidar integration, calibration and validation was successfully performed, leading to the demonstration of direct backscatter measurements up to 10km atmospheric height, and HSRL measurement of the atmospheric boundary layer aerosol. Such measurements compared very well to the co-located lidar measurements conducted via the ELF and MPLNET lidar systems. For the STTR Phase 2 program, Fibertek and UMBC propose to mature this technology platform, to develop, test, deliver and demonstrate a completed standalone HSRL lidar system capable continuos lidar measurement. The HSRL lidar transmitter sub-system can be also used for airborne HSRL missions, and the design is both power-scalable and compatible with a qualification roadmap, for future space-based HSRL missions.","POTENTIAL NASA COMMERCIAL APPLICATIONS (Limit 1500 characters, approximately 150 words) (1) Ground-based High-Spectral Resolution Lidar (HSRL) for atmospheric aerosol mapping (2) Airborne/UAS and potentially space-based aerosol mapping (3) Enables multi-beam approach to high-resolution lidar mapping (4) Direct-detection lidar transmitter applications, enabled by the arbitrary optical waveform capability of proposed fiber-lidar transmitter","POTENTIAL NON-NASA COMMERCIAL APPLICATIONS (Limit 1500 characters, approximately 150 words) (1) Precision lidar ranging applications for target range estimation (2) Target tracking of rocket,artillery, mortar (RAM) for military applications","Fiber (see also Communications, Networking & Signal Transport; Photonics); Lasers (Ladar/Lidar); Optical/Photonic (see also Photonics)",,"University of Maryland, Baltimore County","1000 Hilltop Circle, Baltimore, MD 21250 - 0002",(410) 455-3140
10-2 T8.03-9945,NNX11CI34P,Innovative Green Technologies for Renewable Energy Sources,Alternative Green Technology for Power Generation Using Waste-Heat Energy And Advanced Thermoelectric Materials,Brimrose Technology Corporation,"19 Loveton Circle, P.O. Box 616, Sparks, MD 21152 - 9201",(410) 472-2600,Sudhir B Trivedi,strivedi@brimrosetechnology.com,"P.O. Box 616, #19 Loveton Circle, Sparks, MD 21152 - 9201",,(410) 472-2600,,,,,,4,6,"TECHNICAL ABSTRACT (Limit 2000 characters, approximately 200 words) NASA is interested in advancing green technology research for achieving sustainable and environmentally friendly energy sources. Thermo-electric power generation (TEPG) has exceptionally rich potential to fulfill this need. A TEPG module requires (1) material that can provide high figure of merit while still providing efficient heat control; (2) low resistance ohmic contacts that operate at high temperature; and (3) efficient heat sink material to provide optimal temperature difference between hot and cold junctions. In Phase I, we addressed all of these issues. We successfully produced device quality n-type and p-type, single crystalline and bulk nano-composite PbTe material suitable for TEPG device fabrication. We also developed a novel electrical contact technology having low electrical resistance and capability to withstand significantly elevated temperatures (>800 degree C). And we developed a light weight, highly thermal conductive (50 to 60 % better than copper) heat sink material with tailored low coefficient of thermal expansion (CTE). These improvements allowed us to develop the design and technique for fabrication of large scale TEPG on a manufacturing level. In Phase II we will expand upon these developments and implement them. We will fabricate TEPG devices using the nano-composite materials. These devices will utilize the ohmic contacts and the heat sink technology that we developed. We will also utilize another approach that we developed in which two materials (PbTe and (Bi-Sb)2(Se-Te)3 based alloys) are segmented into a two-part material that has high efficiency over the entire temperature range from 200-500 degreeC, PbTe being at the hot end and the (Bi-Sb)2(Se-Te)3 based material at the cold end. Our ultimate goal will be to build a TEPG module using such segmented devices to demonstrate the generation of 1kWatt of power. We will develop the technology of fabricating these modules at a large scale manufacturing level, at low cost.","POTENTIAL NASA COMMERCIAL APPLICATIONS (Limit 1500 characters, approximately 150 words) The product of the proposed research is nanostructured bulk thermoelectric materials that have higher efficiency than conventional materials so that high levels of power can be produced in an environmentally clean (pollution free) manner. The manufacturing technology developed during this program will not only be applicable to the proposed materials but to any thermoelectric material with suitable modifications. This will result in manufacturing of thermoelectric power generation and cooling devices with high efficiency and at economically viable cost. NASA anticipates the need for advanced power generation and conversion that goes well beyond the capabilities of the current level of technology for the success of its future missions. Systems are needed that provide significantly better conversion efficiency, higher specific power and enhanced operational capabilities. Thermo-electric power generation (TEPG) has exceptionally rich potential to contribute to electrical power generation in space based applications, and the potential of enabling large-scale electric power generation.","POTENTIAL NON-NASA COMMERCIAL APPLICATIONS (Limit 1500 characters, approximately 150 words) The materials and devices that will result from this research will be useful for both power generation and cooling applications. Major commercial application is in the area of vehicle waste heat recovery (generally from the exhaust pipe) and is very attractive to auto makers in the country. Government agencies like DOD and DOE have a need for thermoelectric power generation for specialized applications. TEPG modules built from suitable thermoelectric materials can be used to build self-powered water and space heating systems, to retrieve the waste heat emitted from incinerators, power plants, or other similar sources, to promote the practice of green building, and even to generate power using human body heat. Development of TEPG materials will advance the state-of-the art in systems and components by reducing / replacing the use of fossil fuels in a cost effective manner.","Active Systems; Composites; Generation; Nanomaterials; Sources (Renewable, Nonrenewable)",,Penn State University - ARL,"P.O. Box 30, State College, PA 16804 - 0030",(814) 863-3991
